1971 Oct 7,"Northern Ireland Prime Minister Brian Faulkner meets with British Prime Minister Edward Heath; they agree to send an additional 1,500 British Army troops to Northern Ireland"
1971 Oct 7,"""The French Connection"" directed by William Friedkin and starring Gene Hackman, Roy Scheider and Fernando Rey premieres in the US (Academy Awards Best Picture 1972)"
1971 Oct 8,"John Lennon releases his megahit single ""Imagine"""
1971 Oct 8,US performs nuclear test at Nevada Test Site
1971 Oct 9,Japanese Emperor Hirohito visits the Netherlands
1971 Oct 9,USSR performs nuclear test at Eastern Kazakh/Semipalitinsk USSR
1971 Oct 10, 5th Country Music Association Award: Charlie Pride wins
1971 Oct 10," Fenholt & Webber's musical ""Jesus Christ Superstar"" premieres in NYC"
1971 Oct 10," Rain washes out Game 2, 1st World Series postponement since 1962"
1971 Oct 11, 60th Davis Cup: USA beats Romania in Charlotte (3-2)
1971 Oct 11," Brooks Robinson ties Series record, reaches base 5 straight times"
1971 Oct 11, Frank McGee becomes news anchor of Today Show
1971 Oct 11, Switzerland recognizes North Vietnam
1971 Oct 12," ""Jesus Christ Superstar"" opens at Mark Hellinger NYC for 711 performances"
1971 Oct 13, 1st World Series night game (Pittsburgh 4-Baltimore 3)
1971 Oct 13," WTZH TV channel 24 in Meridian, MS (CBS) suspends broadcasting"
1971 Oct 14, 2 killed in Memphis racial disturbances
1971 Oct 14," John Lennon and Yoko Ono appear on ""Dick Cavett Show"""
1971 Oct 15," The start of the 2,500-year celebration of Iran, celebrating the birth of Persia"
1971 Oct 16, Amphitheater in McLaren Park is dedicated in San Francisco
1971 Oct 17, Cleveland Metroparks' Rocky River Nature Center opens
1971 Oct 17," Pittsburgh Pirates beat Baltimore Orioles, 4 games to 3 in 68th World Series"
1971 Oct 17," It is estimated today that approximately 16,000 households were withholding rent and rates for council houses as part of the campaign of civil disobedience against internment organised by the Social Democratic and Labour Party, Northern Ireland"
1971 Oct 19," Last issue of ""Look"" magazine is published"
1971 Oct 19, A group of Northern Ireland Members of Parliament begin a 48 hour hunger strike against the policy of Internment
1971 Oct 20," ""Ain't Supposed to Die a Natural Death"" opens at Barrymore for 325 per"
1971 Oct 20, West German Chancellor Willy Brandt is awarded Nobel Peace Prize
1971 Oct 20, The Nepal stock exchange collapses.
1971 Oct 20, Senator in the US Congress Edward Kennedy calls for a withdrawal of British troops from Northern Ireland and all-party negotiations to establish a United Ireland
1971 Oct 21," ""To Live Another Summer"" opens at Helen Hayes NYC for 173 performances"
1971 Oct 21, Nobel prize for literature awarded to Pablo Neruda
1971 Oct 21, USSR performs nuclear test at Eastern Kazakh/Semipalitinsk USSR
1971 Oct 21," William H Rehnquist & Lewis F Powell nominated to US Supreme Court by Nixon, following resignations of Justices Hugo Black & John Harlan"
1971 Oct 22, USSR performs nuclear test
1971 Oct 23," WXLT (now WWSB) TV channel 40 in Sarasota-Bradenton, FL (ABC) begins"
1971 Oct 23, Two female members of the Irish Republican Army (IRA) are shot dead by the British Army in the Lower Falls area of Belfast
1971 Oct 23," Three Catholic civilians are shot dead by the British Army during an attempted robbery in Newry, County Down"
1971 Oct 24, Harry Drake sets longest arrow flight by a footbow (1 mile 268 yds)
1971 Oct 24, Texas Stadium opens-Cowboys beat Patriots 44-21
1971 Oct 24," President of Sinn Féin Ruairi O'Brady, addresses a party conference in Dublin and proclaims that the North of Ireland must be made ungovernable as a first step to achieve a united Ireland"
1971 Oct 24, A member of the Irish Republican Army (IRA) is shot dead by undercover Royal Ulster Constabulary officers during a bomb attack in Belfast
1971 Oct 25, Belgium & People's Republic of China establish diplomatic relations
1971 Oct 25, General Meeting of UN agrees to admit People's Republic of China
1971 Oct 25, United Nations votes to expel the Chinese Nationalist ruled Taiwan and admit the Communist People's Republic of China
1971 Oct 25, A man dies two days after being shot during an Irish Republican Army attack on the British Army in Belfast
1971 Oct 26, UN votes to replace Taiwan with China
1971 Oct 26," An Assembly, attended only by Nationalist politicians, and acting as an alternative to Stormont, meet in Dungiven Castle"
1971 Oct 27, Republic of Congo-Kinshasa becomes Republic of Zaire
1971 Oct 27, Gerard Newe becomes the first Catholic to serve in any Northern Ireland government since 1920; Newe was appointed to try to improve community relations
1971 Oct 28, Great Britain becomes 6th nation to have a satellite (Prospero) in orbit
1971 Oct 28," John Lennon and Yoko Ono record ""Happy Xmas (War is Over)"" in NYC"
1971 Oct 31," ""On the Town"" opens at Imperial Theater NYC for 65 performances"
1971 Oct 31, The Irish Republican Army (IRA) explode a bomb at the Post Office Tower in London
1971 Nov 1,Eisenhower dollar put into circulation
1971 Nov 2,"""Great Harp"" opens at Martin Beck Theater NYC for 7 performances"
1971 Nov 2,"Baltimore Orioles pitcher Pat Dobson no-hits the Yomiuri Giants, 2 - 0; first no-hitter in history of exhibition play between American and Japanese teams"
1971 Nov 3,"""Play Misty For Me"" premieres"
1971 Nov 5,Bolivia passes death penalty for political kidnapping
1971 Nov 5,NBA's LA Lakers starts a 33 game consecutive victory streak
1971 Nov 6,"""Great Harp"" closes at Martin Beck Theater NYC after 7 performances"
1971 Nov 6,US performs underground nuclear test at Amchitka Island Aleutians
1971 Nov 9,"David Storey's ""Changing Room"" premieres in London"
1971 Nov 9,John List kills family & moves to Colorado
1971 Nov 10," Joe Torre wins NL MVP, Vida Blue wins AL MVP"
1971 Nov 10, US table tennis team arrived in China
1971 Nov 11," Man-made earthslide at Kawasaki Japan, kills 15"
1971 Nov 11," Neil Simon's ""Prisoner of Second Avenue"" premieres in NYC"
1971 Nov 13," Mariner 9, 1st to orbit another planet (Mars)"
1971 Nov 14, Enthronment of Pope Shenouda III as Pope of Alexandria
1971 Nov 15, Intel advertises 4004-processor
1971 Nov 16," The Compton inquiry is published, acknowledging that there was ill-treatment of internees, but rejected claims of systematic brutality or torture (Northern Ireland)"
1971 Nov 16, The US increase air activity to support the Cambodian government as fighting neared Phnom Penh
1971 Nov 18," China performs nuclear test at Lop Nor, PRC"
1971 Nov 18, A British soldier is shot dead by the Irish Republican Army (IRA) in Belfast
1971 Nov 19, Disney World's Fort Wilderness opens
1971 Nov 20, US performs nuclear test at Nevada Test Site
1971 Nov 20, 21st NASCAR Sprint Cup: Richard Petty wins
1971 Nov 21, NY Rangers scores a NHL record 8 goals in 1 period
1971 Nov 21, Richard Baker becomes teacher of San Francisco Zen Center
1971 Nov 21," Battle of Garibpur: Indian troops aided by the Mukti Bahini, Bengali guerrillas, defeat the army of Pakistan"
1971 Nov 22," ""Only Fools Are Sad"" opens at Edison Theater NYC for 144 performances"
1971 Nov 22," A member of the Irish Republican Army (IRA) is killed in a premature bomb explosion in Lurgan, County Armagh"
1971 Nov 23, China People's Republic seated in UN Security Council
1971 Nov 23," Danny Murtaugh, manager of MLB world champions Pittsburgh Pirates, announces his retirement"
1971 Nov 24," Braves catcher-infielder Earl Williams, wins NL Rookie of Year"
1971 Nov 24," Prison rebellion at Rahway State Prison, New Jersey"
1971 Nov 24," American ""Dan Cooper"" hijacks plane, extorts $200,000 ransom before jumping out of plane over Washington State, never seen again"
1971 Nov 24," A woman is killed after members of the Irish Republican Army carry out an attack on British soldiers in Strabane, County Tyrone"
1971 Nov 24," A British Army bomb-disposal specialist is killed by a bomb in Lurgan, County Armagh"
1971 Nov 25," 37th Heisman Trophy Award: Pat Sullivan, Auburn (QB)"
1971 Nov 25," British Labour Party leader Harold Wilson proposes Britain should work towards a withdrawal from Northern Ireland, and after 15 years; the Republic of Ireland could rejoin the British Commonwealth"
1971 Nov 27, Soviet Mars 2 becomes 1st spacecraft to crash land on Mars
1971 Nov 27," Two Customs officials are shot by an Irish Republican Army sniper firing upon a British Army patrol investigating a bomb attack on a Customs Post near Newry, County Armagh"
1971 Nov 27, 36th Iron Bowl: Alabama beats Auburn 31-7 in Birmingham
1971 Nov 28," ""Me Nobody Knows"" closes at Helen Hayes Theater NYC after 587 performances"
1971 Nov 28," CFL Grey Cup, Empire Stadium, Vancouver: Calgary Stampeders beat Toronto Argonauts, 14-11 on a slick, rain-covered field"
1971 Nov 29, 1st pro golf championship at Walt Disney World
1971 Nov 29, USSR performs nuclear test at Eastern Kazakh/Semipalitinsk USSR
1971 Nov 30," TV movie ""Brian's Song"" airs for 1st time on ABC-TV"
1971 Nov 30, The government of the Republic of Ireland states that it will take the allegations of brutality against the security forces in Northern Ireland to the European Court of Human Rights
1971 Dec 1,"Chicago Cubs release longtime star and future Hall of Famer Ernie Banks, ending his 19-year MLB career; announce Banks will serve as a coach on manager Leo Durocher's staff; Banks finishes with 512 home runs and 1,636 RBI"
1971 Dec 1,"Galt MacDermot and John Guare's ""Two Gentlemen of Verona"" opens at St James Theater NYC for 613 performances"
1971 Dec 1,"John Lennon and Yoko Ono release ""Happy Xmas (War is Over)"" in US"
1971 Dec 1,"Cambodian Civil War: Khmer Rouge rebels intensify assaults on Cambodian government positions, forcing their retreat from Kompong Thmar and nearby Ba Ray."
1971 Dec 2,Soviet space probe Mars 3 is first to soft land on Mars
1971 Dec 2,United Arab Emirates (Trucial States) declares independence from UK
1971 Dec 2,"Abu Dhabi, Ajman, Dubai, Fujeira, Sharjah & Umm ak Qiwain form United Arab Emirates"
1971 Dec 2,Zayed bin Sultan Al Nahyan is appointed President of the United Arab Emirates
1971 Dec 2,Frank Robinson is traded from the Baltimore Orioles to the Los Angeles Dodgers
1971 Dec 3,US President Richard Nixon commutes Jimmy Hoffa's jail term
1971 Dec 3,India invades West Pakistan and a full scale war begins claiming hundreds of lives and starting the Indo-Pakistani War of 1971
1971 Dec 4,The UN Security Council calls an emergency session to consider the deteriorating situation between India and Pakistan
1971 Dec 4,The Indian Navy attacks the Pakistan Navy and Karachi
1971 Dec 4,"McGurk's Bar bombing: the UVF explode a bomb at a Catholic-owned pub in Belfast, killing fifteen Catholic civilians and wounding seventeen others; this was the highest death toll from a single incident in Belfast during 'the Troubles'"
1971 Dec 5,"KCBJ (now KMIZ) TV channel 17 in Columbia, MO (ABC) 1st broadcast"
1971 Dec 5,Libya nationalizes British Petroleum concession
1971 Dec 6,Lewis Franklin Powell confirmed as US Supreme Court justice
1971 Dec 6,A woman dies trying to salvage property from the Salvation Army Citadel in Belfast after bomb which started a large fire in an adjoining building
1971 Dec 7,"""Wild & Wonderful"" opens/closes at Lyceum Theater NYC"
1971 Dec 7,"Wings release their 1st album ""Wild Life"""
1971 Dec 7,"An off duty member of the Ulster Defence Regiment is shot dead by members of the Irish Republican Army in County Tyrone, Northern Ireland"
1971 Dec 9,Lewis F. Powell Jr. appointed to US Supreme Court
1971 Dec 10, West German Chancellor Willy Brandt receives the Nobel Peace Prize
1971 Dec 10, William H Rehnquist confirmed as Supreme Court justice
1971 Dec 11, The Libertarian Party of the United States is formed
1971 Dec 11," A bomb explodes outside a furniture showroom on the mainly-Protestant and loyalist Shankill Road, Belfast; four civilians (including two babies) were killed and nineteen wounded"
1971 Dec 12," Romanian tennis star Ilie Năstase finishes ATP Masters Grand Prix with a perfect 6-0 record to win the rich season ending event at the Coubertin Stadium, Paris"
1971 Dec 13," John Sinclair (sentence: 10 yrs, sold 2 marijuana joints) is freed"
1971 Dec 14, Golden Gate Bridge lights out all night due to power failure
1971 Dec 14, US performs nuclear test at Nevada Test Site
1971 Dec 14," U.S. premiere of ""Nicholas and Alexandra"", film adaptation of Robert K. Massie's best selling novel"
1971 Dec 14," The Pakistan Army executes an estimated 1,111 of East Pakistan's intellectuals during the Bangladesh Liberation War"
1971 Dec 15, USSR performs nuclear test at Eastern Kazakh/Semipalitinsk USSR
1971 Dec 16," Vijay Diwas (Victory Day): East Pakistan's independence (as Bangladesh) from Pakistan is recognized internationally after India's army occupies Dacca, and 93,000 West Pakistani troops surrender"
1971 Dec 16," Don McLean's 8+ minute version of ""American Pie"" released"
1971 Dec 17," ""Diamonds are Forever"", 7th James Bond film, last starring Sean Conner, also starring Jill St. John is 1st released in West Germany"
1971 Dec 17, Cease fire between India & Pakistan in Kashmir
1971 Dec 17, Radio Bangladesh begins transmitting
1971 Dec 18," 1st Candlelight Processional at the EPCOT Center, Disney World"
1971 Dec 18, CBS radio cancels Saturday morning band concerts
1971 Dec 18, People United To Save Humanity (PUSH) formed by Jesse Jackson in Chicago
1971 Dec 18," US dollar devalued 7.9% in Holland ($1=Ÿ3,245)"
1971 Dec 18," Three members of the Irish Republican Army die when the bomb they were transporting explodes prematurely in King Street, Magherafelt, County Derry."
1971 Dec 19," ""Inner City"" opens at Barrymore Theater NYC for 97 performances"
1971 Dec 19," CBS airs ""Homecoming A Christmas Story,"" (introducing the Waltons)"
1971 Dec 19, NASA launches Intelsat 4 F-3 for COMSAT Corp
1971 Dec 19," Stanley Kubrick's X-rated film ""A Clockwork Orange"" based on the book by Anthony Burgess and starring Malcolm McDowell premieres"
1971 Dec 20, Pakistan president Yahya Khan resigns
1971 Dec 20," First preview issue of ""Ms"" magazine is published in the US launched by Gloria Steinem"
1971 Dec 21, UN Security Council chooses Kurt Waldheim as 4th Secretary-General
1971 Dec 21," A publican is killed as he tried to remove a bomb from his pub, Northern Ireland"
1971 Dec 22," KUAC TV channel 9 in Fairbanks/College, AK (PBS) begins broadcasting"
1971 Dec 22, UN General Assembly ratifies former Austrian President Kurt Waldheim as Secretary-General
1971 Dec 22, USSR performs underground nuclear test
1971 Dec 23, British Prime Minister Edward Heath visits Northern Ireland and expresses his determination to end the violence
1971 Dec 24," Peruvian Airlines Electra crashes at headwaters of Amazon, killing all except Juliane Margaret Koepcke found 10 days later"
1971 Dec 25, Longest NFL game (82m40s) as Dolphins beat Chiefs 27-24
1971 Dec 25, Operation PUSH (People United to Save Humanity) formed by Jesse Jackson
1971 Dec 25, Worst hotel fire in history kills 163 at Taeyokale Hotel in Seoul
1971 Dec 26," Muhammad Ali finishes off German Jürgen Blin with a thundering right cross for a 7th-round knockout in a non-title heavyweight boxing contest in Zurich, Switzerland"
1971 Dec 27," 1st Fiesta Bowl: #8 Arizona State beats Florida State, 45-38"
1971 Dec 28, Hashish now falls under the Dutch Opium Law (Opiumwet)
1971 Dec 28, Ballon d'Or: Ajax forward Johan Cruyff wins award for best European football player ahead of Inter forward Sandro Mazzola and Manchester United winger George Best; first Dutch national and Ajax player to win award
1971 Dec 30, Long Island NHL franchise purchased (NY Islanders)
1971 Dec 30, USSR performs nuclear test at Eastern Kazakh/Semipalitinsk USSR
1971 Dec 30," A member of the Irish Republican Army is killed in a premature bomb explosion in Santry, Dublin."
1971 Dec 31," KAID TV channel 4 in Boise, ID (PBS) begins broadcasting"
1971 Dec 31," Lt Gen Robert E Cushman, Jr, USMC, ends term as deputy director of CIA"
1971 Dec 31," Edmund Compton, then Northern Ireland Ombudsman, is replaced by John Benn"
