1974 Nov 24, 2 truck hijackers freed (3/3/1974)
1974 Nov 24," CFL Grey Cup, Empire Stadium, Vancouver: Montreal Alouettes defeat Edmonton Eskimos, 20-7 on a slick, wet field"
1974 Nov 24, Gerald Ford and Leonid Brezhnev sign the SALT-2 treaty to reduce each side's number of nuclear weapons
1974 Nov 24," Most complete early human skeleton (Lucy, Australopithecus) discovered by Donald Johanson, Maurice Taieb, Yves Coppens and Tim White in the Middle Awash of Ethiopia's Afar Depression [1] [2]"
1974 Nov 24, 24th NASCAR Sprint Cup: Richard Petty wins
1974 Nov 25, Irish Republican Army is outlawed in Britain following deaths of 21
1974 Nov 25, Rangers' Mike Hargrove wins AL Rookie of Year
1974 Nov 26, Approximately 140 die when suspension bridge collapses in Nepal
1974 Nov 26, Greenidge scores 107 in 2nd innings of Test Cricket debut v India
1974 Nov 27, Cardinals outfielder Bake McBride wins NL Rookie of Year
1974 Nov 28, Bowie Kuhn suspends George Steinbrenner for 2 years
1974 Nov 28, John Lennon's last concert appearance (Elton John concert in Madison Square Garden NYC)
1974 Nov 29," Coco the Clown [Nicolai Poliakoff] special memorial service held at St. Paul's Cathedral, London, England"
1974 Nov 29, 39th Iron Bowl: Alabama beats Auburn 17-13 in Birmingham
1974 Nov 30," ""Good Evening"" closes at Plymouth Theater NYC after 438 performances"
1974 Nov 30," ""Mack & Mabel"" closes at Majestic Theater NYC after 66 performances"
1974 Nov 30, 20th time Islanders shut-out (3-0 vs Canucks)
1974 Dec 1,"Boeing 727 crashes in Upperville Virginia, 92 died"
1974 Dec 1,"American Jacqueline Hansen runs female world record marathon 2:43:54.5 in Culver City, California"
1974 Dec 1,LA Skid Row slasher kills 1st of 8
1974 Dec 1,South Africa is awarded the Davis Cup tennis title after India refuses to travel to South Africa for the final in protest of the South African government's apartheid policies
1974 Dec 2,"Giant Baba beats Jack Brisco in Kagoshimi, to become NWA champ"
1974 Dec 2,Soyuz 16 launched into Earth orbit for 6 days
1974 Dec 2,"MLB Rules Committee changes long time philosophy to permit the use of cowhide, rather than just horsehide in the manufacture of baseballs"
1974 Dec 4,Dutch DC-8 charter crashes in Sri Lanka killing 191 Muslim pilgrims
1974 Dec 4,Jean-Paul Sartre visits Red Army Faction leader Andreas Baader in prison
1974 Dec 5,"1st World Football League Bowl, Birmingham Americans beat Florida"
1974 Dec 5,Airport terminal roof in Tehran collapses killing 17
1974 Dec 5,Final episode of Monty Python's Flying Circus airs on BBC TV
1974 Dec 5,NFL's Seattle Seahawks forms
1974 Dec 5,Oliver Tilden Triangle in the Bronx named
1974 Dec 5,Birmingham Americans defeat the Florida Blazers 22-21 in the WFL's World Bowl
1974 Dec 6,"George Harrison releases ""Ding Dong, Ding Dong"""
1974 Dec 8,Greek monarchy rejected by referendum
1974 Dec 8,Irish Republican Socialist Party forms
1974 Dec 8,Soyuz 16 returns to Earth
1974 Dec 9,Dow Jones index hits 570.01
1974 Dec 9,"Jack Brisco beats Giant Baba in Tokyo, to become NWA wrestling champ"
1974 Dec 9,Johnson Grigsby freed after 66 years in jail in Indiana
1974 Dec 10, European Economic Community calls for a European Parliament
1974 Dec 10, Helios 1 launched by US and Germany; later makes closest flyby of the Sun
1974 Dec 12, 50‐year‐old Georgia Governor Jimmy Carter announces his candidacy for the Democratic nomination for President [1]
1974 Dec 13, Malta becomes a republic
1974 Dec 14, Islander Glenn Resch's 1st shut-out opponent-Kings 3-0
1974 Dec 14, Viv Richards scores 1st Test Cricket ton 192 v India 20 fours 6 sixes
1974 Dec 15," Guillermo Vilas of Argentina beats defending champion lie Năstase 7–6, 6–2, 3–6, 3–6, 6–4 to win his first and only season-ending ATP Masters Grand Prix tennis final in Melbourne, Australia"
1974 Dec 16, US performs nuclear test at Nevada Test Site
1974 Dec 16," USSR performs nuclear test at Eastern Kazakh, Semipalitinsk USSR"
1974 Dec 18, San Francisco Visitors Center at City Hall opens
1974 Dec 19," ""The Man with the Golden Gun"", 9th James Bond film, starring Roger Moore, Britt Ekland and Christopher Lee, premieres in London"
1974 Dec 19, Dave Kryskow scores Washington Capitals 1st NHL shorthanded goal
1974 Dec 19, Nelson Rockefeller is sworn in as Vice President of the United States
1974 Dec 20, Ethiopia becomes socialist one-party state
1974 Dec 20," George Harrison releases his ""Dark Horse"" album in UK"
1974 Dec 20," ""The Godfather Part II"", directed by Francis Ford Coppola and starring Al Pacino and Robert De Niro, is released (Academy Awards Best Picture 1975)"
1974 Dec 21," Raiders RB Clarence Davis somehow catches game-winning touchdown pass among ""the sea of hands"" of three Dolphins defenders with 24 seconds left in the game, eliminating Miami from the playoffs, 1st time in 3 years"
1974 Dec 22, 2nd cease-fire between IRA & British; lasts until approx April 1975
1974 Dec 22," Phil Esposito, Boston, became 6th NHLer to score 500 goals"
1974 Dec 22," Referenda in Comoros-3 islands for independence, 1 stays French"
1974 Dec 22," Provisional Irish Republican Army bomb home of former UK Prime Minister, Edward Heath, just before announcing Christmas ceasefire"
1974 Dec 22, Iraq announces plans to increase its oil production capacity
1974 Dec 23," ""Good News"" opens at St James Theater NYC for 16 performances"
1974 Dec 23, Premier of Dmitri Shostakovich' Suite on Verses of Michelangelo Buonarroti song cycle in Leningrad
1974 Dec 24, Cardinals' Lou Brock is named Sportsman of the Year
1974 Dec 24, Former US astronaut John Glenn join the Senate for Ohio
1974 Dec 25," Cyclone Tracy virtually destroys Darwin, Australia"
1974 Dec 25," Marshall Fields drives a vehicle through the gates of the White House, resulting in a four-hour standoff."
1974 Dec 26, Washington Capitals 1st NHL sellout
1974 Dec 27," 40th Heisman Trophy Award: Archie Griffin, Ohio State (RB)"
1974 Dec 27, Dear Abby show ends run on CBS radio after 11 years
1974 Dec 27, FSLN seizes government hostages at a private Managua party
1974 Dec 27, USSR performs nuclear test at Eastern Kazakh/Semipalitinsk USSR
1974 Dec 28, 6.3 earthquake strikes Pakistan: 5200 killed
1974 Dec 28, Senegalese marxist group Reenu-Rew founds the political movement And-Jëf at a clandestine congress.
1974 Dec 28," 4th Fiesta Bowl: Oklahoma State beats #17 BYU, 16-6"
1974 Dec 29," Murray Schisgal's ""All Over Town"" premieres in NYC"
1974 Dec 29," AFC Championship, Oakland Coliseum: Pittsburgh Steelers beat Oakland Raiders, 24-13"
1974 Dec 29," NFC Championship, Metropolitan Stadium, Bloomington: Minnesota Vikings beat Los Angeles Rams, 14-10"
1974 Dec 30, Beatles are legally disbanded (4 years after suit was brought)
1974 Dec 31," Gold legal in US, Franklin Mint strikes Panama's Gold 100 balboa coin"
1974 Dec 31, Lindsey Buckingham & Stevie Nicks join Fleetwood Mac
1974 Dec 31," New York Yankees sign Cy Young Award winner Jim ""Catfish"" Hunter for 5 years for a record $3.75 million from the Oakland A's"
1974 Dec 31, Popular Electronics displays Altair 8800 computer
1974 Dec 31," Australian Open Women's Tennis: Australian Evonne Goolagong Cawley retains her title; beats Martina Navratilova of Czechoslovakia 6-3, 6-2"
1974 Dec 31," 41st Sugar Bowl: #8 Nebraska beats #18 Florida, 13-10"
1974 Dec 31," Ballon d'Or: Ajax forward Johan Cruyff wins back-to-back awards, and his 3rd overall, for best European football player ahead of Bayern Munich defender Franz Beckenbauer and Legia Warsaw midfielder Kazimierz Deyna"
