1991 Oct 23," ""Les Miserables"" opens at Mogador Theatre, Paris"
1991 Oct 23, Clarence Thomas sworn in as US Supreme Court Justice
1991 Oct 23, Dr Jack Kevorkian's suicide machine assists 2 women to commit suicide
1991 Oct 24," ""Dancing at Lughnasa"" opens at Plymouth Theater NYC for 421 performances"
1991 Oct 24, Larry Ryckman purchases CFL Calgary Stampeders
1991 Oct 25, Aaqib Javed takes 7-37 in 10 overs v India in cricket 1-dayer at Sharjah
1991 Oct 27," ""Andre Heller's Wonderhouse"" closes at Broadhurst NYC after 9 performances"
1991 Oct 27," ""Homecoming"" opens at Criterion Theater NYC for 49 performances"
1991 Oct 27," World Series Baseball: Minnesota Twins beat Atlanta Braves, 1-0 in 10 in Game 7 at Hubert H. Humphrey Metrodome; win 2nd title since move to Minneapolis; MVP: Twins pitcher Jack Morris"
1991 Oct 29, Buck Showalter replaces Stump Merrill as NY Yankee manager
1991 Oct 30, Colombian government negotiate with M-19-guerrilla
1991 Oct 30, Mark Sauer becomes CEO of Pittsburgh Pirates
1991 Oct 30, Mid East peace conference begins in Madrid Spain
1991 Oct 31, Palestinians attend US mideast peace talks in Madrid
1991 Nov 1,New Dutch Regulations Traffic rules & Traffic signs enforced
1991 Nov 1,"Three faculty, and one staff member of the department of physics and astronomy, were killed, along with one administrator, when physics graduate student Gang Lu went on a shooting rampage at the University of Iowa."
1991 Nov 1,"Last of Kuwait oil well fires extinguished by Canadian well control team ""SafetyBOSS"""
1991 Nov 2,"Jermaine Jackson releases ""Word to the Badd!!"" anti Michael song"
1991 Nov 2,"Nevada makes biggest comeback in NCAA football history, overcoming a 35 point 3rd quarter deficit to rally and beat Weber State, 55-49"
1991 Nov 2,"Breeders' Cup Horse Racing, Churchill Downs; winners: Arazi, Black Tie Affair, Dance Smartly (leading female thoroughbred money-earner, with $3,083,456), Miss Alleged, Opening Verse, Pleasant Stage, Sheikh Albadou"
1991 Nov 2,"Bartholomew I becomes the Patriarch of Constantinople, head of 300 million followers of the Eastern Orthodox Church"
1991 Nov 2,"2nd Rugby World Cup Final, Twickenham: Australia beats England, 12-6 with Wallabies fly-half Michael Lynagh landing 2 penalties and a conversion"
1991 Nov 3,"New York City Marathon: Salvador Garcia of Mexico men's champion in 2:09:28; Liz McColgan of Scotland wins women's title, 2:27.0"
1991 Nov 3,Ayrton Senna wins Australian Grand Prix in Adelaide; shortest F1 race ever run (14 laps) because of wet conditions; Senna retains his 3rd World Drivers Championship by 24 points from Nigel Mansell
1991 Nov 4,Mid East peace conference ends in Madrid Spain
1991 Nov 4,"Imelda Marcos returns from exile to the Philippines and was arrested the next day for tax fraud and corruption. She was then released on $6,400 bail."
1991 Nov 5,Kiichi Miyazawa elected premier of Japan
1991 Nov 5,Richard J Kerr ends term as acting director of CIA
1991 Nov 6,"""Moscow Circus Cirk Valentin"" opens at Gershwin NYC for 32 performances"
1991 Nov 6,Grand Duke Vladimir Kirillovitsj returns to St Petersburg
1991 Nov 6,"Keck II, biggest telescope in use at Mauna Kea Hawaii"
1991 Nov 6,Maximus 2.0 BBS released
1991 Nov 6,"Robert M Gates, becomes 15th director of CIA"
1991 Nov 6,Russian President Boris Yeltsin outlaws Communist Party
1991 Nov 6,The last oil fire in Kuwait set by retreating Iraqi troops is extinguished
1991 Nov 7,"""Brigadoon"" opens at New York State Theater NYC for 12 performances"
1991 Nov 7,"""Park Your Car in Harvard Yard"" opens at Music Box NYC"
1991 Nov 7,"1st NBA game in Delta City, Utah Jazz beats Seattle 103-95"
1991 Nov 7,Magic Johnson announces he has HIV virus & retires from LA Lakers
1991 Nov 8,Paul Coffey sets NHL defenseman scoring mark with 311th goal
1991 Nov 9,Houston's Roman Anderson is 1st NCAA to kick 400 pts
1991 Nov 9,Joint European Torus (JET) scientists in Culham England successfully harness nuclear fusion to produce the first large amount of controlled fusion power
1991 Nov 10, Bernie Kosar ends NFL record of 308 passes without an interception
1991 Nov 10," Browns set club record for largest lead blown (led 23-0), Philadelphia 32-30"
1991 Nov 10, Martina Navratilova ties Chris Evert with 157 pro tennis tournament wins
1991 Nov 10," Marty Glickman broadcasts his 1,000th football game"
1991 Nov 10, South Africa's 1st cricket international since 1970 - one-day v India
1991 Nov 12," ""Full House"" 100th episode, the twins are born"
1991 Nov 12, Atlanta Brave Tom Glavine wins NL Cy Young Award
1991 Nov 12," Dili Massacre, Indonesian forces open fire on a crowd of protesters in Dili, East Timor, killing at least 250"
1991 Nov 13," Bomb destroys Dutch Labour party politician Aad Kosto's house in a failed assassination attempt, he survives and in a famous image finds and cuddles his cat"
1991 Nov 13, Boston Red Sox Roger Clemens wins AL Cy Young Award
1991 Nov 14," Michael Jackson's ""Black or White"" video premieres on FOX TV"
1991 Nov 14, Pittsburgh Steelers guard Terry Long loses his steroids appeal and is suspended without pay by NFL for 4 weeks
1991 Nov 14, American and British authorities announce indictments against two Libyan intelligence officials in connection with the downing of the Pan Am Flight 103
1991 Nov 14, Cambodian Prince Norodom Sihanouk returns to Phnom Penh after thirteen years of exile
1991 Nov 15, Dow Jones avg drops 120.31 points (5th largest dive)
1991 Nov 15, Ricky Pierce (Seattle) begins NBA free throw streak of 75 game
1991 Nov 17," ""Brigadoon"" closes at New York State Theater NYC after 12 performances"
1991 Nov 17, 1st TV condom ad aired (FOX- TV)
1991 Nov 17, Detroit Lion Mike Utley is paralized in a game vs LA Rams
1991 Nov 17, 41st NASCAR Sprint Cup: Dale Earnhardt wins
1991 Nov 17," In an all-American final Pete Sampras wins his first of 5 ATP Tour World Championship tennis titles with a 3–6, 7–6, 6–3, 6–4 victory over Jim Courier in Frankfurt, Germany"
1991 Nov 18, France deports Marlon's daughter Cheyenne Brando to Tahiti
1991 Nov 18, Muslim Shi'ites release hostages Terry Waite & Thomas Sutherland
1991 Nov 18, Auburn men's basketball team placed on 2 yr probation for recruiting violations and not eligible for post-season play 1991-92
1991 Nov 18, The Croatian city of Vukovar surrenders to Yugoslav People's Army and allied Serb paramilitary forces after an 87-day siege
1991 Nov 19, Baltimore Orioles shortstop Cal Ripken wins his 2nd AL MVP
1991 Nov 20, Atlanta Braves Terry Pendleton wins NL MVP
1991 Nov 21, Poetess Maria Elene Cruz Varela arrested in Cuba
1991 Nov 22, NY Knicks pay Patrick Ewing a record $18.8 million for 2 yr extension
1991 Nov 22," ""Phool Aur Kaante"", the film debut of famous Indian actor Ajay Devgan, is released"
1991 Nov 23," Freddie Mercury, 45, confirms he has AIDS the day before he dies"
1991 Nov 23, Evander Holyfield TKOs Bert Cooper in 7 for heavyweight boxing title
1991 Nov 23, Martín López-Zubero swims world record 200m backstroke (1:56.57)
1991 Nov 23, Sacramento Kings ends NBA's longest road losing streak at 43 games
1991 Nov 23," Brigham Young University quarterback Ty Detmer finishes NCAA career with record 4,031 yards passed in a season, and 15,031 yards for career"
1991 Nov 24, 1st international flight from Long Island's MacArthur Airport (to Mexico)
1991 Nov 24," CFL Grey Cup, Winnipeg Stadium: Toronto Argonauts defeat Calgary Stampeders, 36-21; Argos under new ownership of LA Kings owner Bruce McNall, hockey player Wayne Gretzky and actor John Candy"
1991 Nov 24," After going 12-0, Washington Redskins lose to Dallas 24-21"
1991 Nov 24," Monica Seles sets female tennis record, winning prize money of $2,457,758 in a year"
1991 Nov 24, Rachmon Nabijev elected president of Tadzjikistan
1991 Nov 24," US 75th manned space mission ""STS 44"" Atlantis 10 launched"
1991 Nov 24," Yugoslavian tennis star Monica Seles beats Martina Navratilova 6–4, 3–6, 7–5, 6–0 to win her 2nd straight WTA Tour Championship at Madison Square Garden, NYC"
1991 Nov 26, Condoms are handed out to thousands of NY High School students
1991 Nov 27," ""Peter Pan"" opens at Minskoff Theater NYC for 48 performances"
1991 Nov 27, Poetess Maria Elene Cruz Varela sentenced to 2 years (Cuba)
1991 Nov 27, Undertaker beats Hulk Hogan to become new WWF champ
1991 Nov 29," TV show ""Roc"" has a gay wedding episode - Can't Help Loving that Man"
1991 Nov 29," Test Cricket debut of Javagal Srinath, v Australia at the Gabba"
1991 Nov 30," FIFA Women's World Cup Final, Tianhe Stadium, Guangzhou, China: Michelle Akers scores twice as US beats Norway, 2-1"
1991 Nov 30," 93 cars and 11 truck accident near San Francisco during a dust storm, 17 die"
1991 Nov 30," Rob Pilatus, 27, of Milli-Vanilli attempts suicide"
1991 Nov 30, San Diego State's Marshall Faulk is 1st freshman to capture national rushing and scoring titles
1991 Nov 30, 56th Iron Bowl: Alabama beats Auburn 13-6 in Birmingham
1991 Dec 1,"""Moscow Circus Cirk Valentin"" closes at Gershwin NYC after 32 performances"
1991 Dec 1,"""Once on this Island"" closes at Booth Theater NYC after 469 performances"
1991 Dec 1,"Davis Cup Tennis, Lyon: Frenchman Guy Forget upsets Pete Sampras 7-6, 3-6, 6-3, 6-4 to clinch a 3-1 final win over the US"
1991 Dec 1,Colorado party wins Paraguay parliamentary election
1991 Dec 1,Nursultan Nazarbayev sworn in as president of Kazakhstan
1991 Dec 1,"US 75th manned space mission ""STS 44"" Atlantis 10 lands"
1991 Dec 1,Ukrainian people vote for independence
1991 Dec 1,"Miami quarterback Dan Marino sets an NFL record when he reaches 3,000 yards passing for the 8th time in his career during Dolphin's 33-14 win over Tampa Bay at Joe Robbie Stadium"
1991 Dec 1,"Reigning US Open champion Payne Stewart wins only 1 hole, but claims the Skins Game at La Quinta and sets record in the process; 3-foot birdie putt at 14th hole earns 8 skins worth $260,000; record for most money won on 1 hole"
1991 Dec 2,Former Pittsburgh Pirates outfielder Bobby Bonilla becomes highest paid player in MLB when he agrees to record $29 million-5 year deal with New York Mets
1991 Dec 2,Muslim Shi'ites release American hostage Joseph Cicippio held in Lebanon
1991 Dec 2,Australia routs India by 10 wickets in the 1st cricket Test in Brisbane; first Test to be officiated by a match referee; former England captain MJK Smith does the honours
1991 Dec 3,Hulk Hogan defeats the Undertaker at 'This Tuesday in Texas' at the Freeman Coliseum in San Antonio to become 4-time WWF champion
1991 Dec 3,Muslim Shi'ites release US hostage Alan Steen
1991 Dec 3,White House Chief of Staff John Sununu resigns
1991 Dec 4,Judds final concert (Nashville)
1991 Dec 4,Muslim Shi'ites release last US hostage Terry Anderson (held 6½ years)
1991 Dec 4,Pan American World Airways ceased operations
1991 Dec 4,Patricia Bowman testifies that William Kennedy Smith raped her
1991 Dec 5,"""Catskills on Broadway"" opens at Lunt-Fontanne NYC for 452 performances"
1991 Dec 5,"Charles Keating Jr (Lincoln Savings & Loan fraud), found guilty"
1991 Dec 5,NY Daily News files for protection under chapter 11
1991 Dec 6,"""Les Miserables"" opens at Circustheater, Scheveningen"
1991 Dec 6,"""Star Trek VI-Undiscovered Country"" premieres"
1991 Dec 7,"A J Kitt, US, wins World Skiing Cup"
1991 Dec 8,"""Homecoming"" closes at Criterion Theater NYC after 49 performances"
1991 Dec 8,"""Nick & Nora"" opens at Marquis Theater NYC for 9 performances"
1991 Dec 8,"Russia, Belorussia & Ukraine form Commonwealth of Ind States"
1991 Dec 8,The Romanian Constitution is adopted in a referendum.
1991 Dec 9,"2nd Billboard Music Awards: Michael Jackson, Billy Ray Cyrus, Boyz II Men & U2 win"
1991 Dec 10," ""Crucible"" opens at Belasco Theater NYC for 32 performances"
1991 Dec 10, IM Pei receives $5 million for design of Rock & Roll Hall of Fame
1991 Dec 10, Jackie Martling walks off of Howard Stern show for 1 day
1991 Dec 10, Howard Spira sentenced to 2½ years in prison for trying to extort money from Yankees owner George Steinbrenner
1991 Dec 11, William Kennedy Smith found not guilty of rape
1991 Dec 12, NJ Nets set NBA record of 22 blocks beating Nuggets 121-81
1991 Dec 12, Orion Pictures filed Chapter 11 for bankruptcy protection
1991 Dec 12, Tampa Bay Buccaneer Dexter Manley retires after failing drug test
1991 Dec 12, Abuja replaces Lagos as the capital city of Nigeria
1991 Dec 13, Both North and South Korea sign an accord calling for reconciliation
1991 Dec 13, NY assembly speaker Mel Miller is convicted of federal mail fraud
1991 Dec 13, Ricky Pierce (Seattle) ends NBA free throw streak of 75 games
1991 Dec 14," 57th Heisman Trophy Award: Desmond Howard, Michigan (WR)"
1991 Dec 14," Ferry boat Salem Express sinks in the Red Sea, 476 killed"
1991 Dec 15," ""Nick & Nora"" closes at Marquis Theater NYC after 9 performances"
1991 Dec 16," Florida Marlins sign their 1st player, 16 year old pitcher Clemente Nunez"
1991 Dec 16, UN reverses ruling that Zionism is racism by 111-25 (13 abstain) vote
1991 Dec 16, Independence of the Republic of Kazakhstan.
1991 Dec 17," Cleveland Cavaliers beat Miami Heat 148-80, by record 68 pts"
1991 Dec 17, NBA's most lopsided game Cleveland beats Miami 148-80
1991 Dec 17, Patrick Manning becomes premier of Trinidad & Tobago
1991 Dec 17," Soap opera ""One Life To Live"" airs its 6,000th episode"
1991 Dec 17, Pittsburgh Penguins score team record 8 goals in one period in 2nd session of 10-2 win over NHL expansion San Jose Sharks
1991 Dec 18, DeForest Kelly (Dr McCoy on Star Trek) gets a star in Hollywood
1991 Dec 18, General Motors announces closing of 21 plants
1991 Dec 19," ""Christmas Carol"" opens at Eugene O'Neill Theater NYC for 14 performances"
1991 Dec 19," 6,000th episode of One Life To Live"
1991 Dec 19, Boris Yeltsin takes control of the Kremlin
1991 Dec 19, NY Yankee pitcher Steve Howe arrested for cocaine possession
1991 Dec 20, NHL grants permanent membership to Tampa Lightning & Ottawa Senators
1991 Dec 20, Paul Keating becomes Prime Minister of Australia after rolling Bob Hawke for leadership of the Labor party
1991 Dec 20, A Missouri court sentences the Palestinian militant Zein Isa and his wife Maria to death for the honor killing of their daughter Palestina.
1991 Dec 20," ""Father of the Bride"" film starring Steve Martin, Diane Keaton, and Martin Short, is released"
1991 Dec 21, 95 share in Madrid Spain $1.3 billion lottery (#47996)
1991 Dec 21, El Sayid Nosair acquitted of killing Meir Kahane
1991 Dec 21, Soviet Union formally dissolves as 11 of 12 republics sign treaty forming Commonwealth of Independent States
1991 Dec 23, NY Daily News publisher Kevin Maxwell resigns
1991 Dec 24, Ballon d'Or: Marseille forward Jean-Pierre Papin is named Europe's best football player; first from the French League to win the trophy
1991 Dec 25, Last day of a washout Pakistan v Sri Lanka at Gujranwala
1991 Dec 25, Mikhail Gorbachev formally resigns as President of USSR in a televised speech
1991 Dec 26, Chuck Knolls retires as NFL coach after 23 years
1991 Dec 26," Jack Ruby's gun sells for $220,000 in auction"
1991 Dec 26, Militant Sikhs kill 55 & wound 70 in India
1991 Dec 26, NY Islander Derek King ties NJ Devils 5-5 with ½ second left
1991 Dec 26," Future Hockey Hall of Fame right wing Joe Mullen scores 4 goals for the second straight NHL game as the Pittsburgh Penguins rout Toronto, 12-1; Mario Lemieux adds 2 goals & 5 assists and Kevin Stevens has 2 goals & 4 assists"
1991 Dec 27, Bengals hire Dave Shula as youngest NFL coach (32)
1991 Dec 27, Chuck Knox retires as Seattle Seahawk coach
1991 Dec 28," 8 are crushed to death at a RAP basketball game at City College, NYC"
1991 Dec 28," Blockbuster Bowl 2: Alabama beats Colorado, 30-25"
1991 Dec 28, Irene the Icon of Greek Orthodox church returns after being stolen
1991 Dec 28," Ninibeth Beatriz Leal Jiminez, 20, of Venez, crowned 41st Miss World"
1991 Dec 28, Ted Turner is named Time Magazine Man of Year
1991 Dec 29," ""Christmas Carol"" closes at Eugene O'Neill Theater NYC after 14 performances"
1991 Dec 29, 12th United Negro College Fund
1991 Dec 29, Boeing 747-200F of China Airlines crash into mountain at Taipei
1991 Dec 31," CPN, Communist Party of Netherland, last day of existence"
1991 Dec 31, Daniel R McCarthy elected NY Yankee managing general partner
1991 Dec 31, Dow Jones closes at record high 3168.83
1991 Dec 31, J Donald Crump resigned as CFL Commissioner
