1992 Jul 25," 25th Olympic Games open in Barcelona, Spain"
1992 Jul 26," ""Man of La Mancha"" closes at Marquis Theater NYC after 108 performances"
1992 Jul 26," US Open Women's Golf, Oakmont CC: Patty Sheehan wins an 18-hole Monday playoff over runner-up Juli Inkster, 72 to 74"
1992 Jul 26, Britain honours her dead in the Falklands War
1992 Jul 26, Nolan Ryan strikes out his 100th batter for 23rd consecutive seasons
1992 Jul 26," Tour de France: Miguel Induráin of Spain defends his title by 4' 35"" from Italian Claudio Chiappucci; Laurent Jalabert points winner"
1992 Jul 27, Astros begins 26-game road trip to make room for Republican National Convention
1992 Jul 27," Dimitri Lepikov, Vladimir Pychenko, Veniamin Taianovitch and Evgueni Sadovyi swim world record 4x200m freestyle (7:11.95)"
1992 Jul 27, Nelson Mandela says a general strike will go ahead to protest for the removal of South African President F. W. de Klerk from power and for free elections
1992 Jul 27, Japanese swimmer Kyoko Iwasaki wins the 200m breaststroke in Barcelona to become the youngest to win an Olympic gold medal at 14 years-6 days
1992 Jul 28," Groundbreaking of Fla Marlins 7,500 seat spring training stadium"
1992 Jul 28," R&B singer Mary J. Blige releases her debut album ""What's the 411?"", with production by Puff Daddy"
1992 Jul 29," ""Chinese Coffee"" closes at Circle in Sq Theater NYC after 18 performances"
1992 Jul 29, Yevgeni Sadovyi of the Unified Team swims world 400m record (3:45.00) to wrap up 200-400m freestyle double at the Barcelona Olympics
1992 Jul 29," Ray Sharkey, actor (Wiseguys), arrested for narcotic possession"
1992 Jul 29," Arkadiusz Skrzypaszek of Poland (5,559 points) beats Hungarian Attila Mizsér by 113 points to win the Pentathlon gold at the Barcelona Olympics; Poland also wins teams gold"
1992 Jul 30, Lin Li swims female world record/OR 200m medley (2:11.65)
1992 Jul 30, Yael Arad becomes Israel's first ever Olympic medalist when she wins silver in the women's 61kg judo in Barcelona; 20th anniversary of Munich massacre and 500th anniversary of Alhambra Decree
1992 Jul 31," Three world record swims on final night session at the Barcelona Olympics; Australian Kieren Perkins 1,500m (14:43.4); Tamás Darnyi of Hungary 200m backstroke (1:59.36); China's Yang Wenyi women's 50m freestyle (24.79)"
1992 Jul 31," Thai Airbus crashes into mountain at Kathmandu, 113 die"
1992 Jul 31, Hungarian swimmer Krisztina Egerszegi earns her 3rd gold medal of the Barcelona Olympics winning 200m backstroke for the 100-200 double along with 400m I/M gold
1992 Aug 1,"""Salome"" closes at Circle in Sq Theater NYC after 9 performances"
1992 Aug 1,"NBC's ""Saturday Today"" premieres"
1992 Aug 1,USA/USSR Around World Air Race begins at Santa Monica
1992 Aug 1,British athlete Linford Christie (32) becomes the oldest man to win an Olympic 100m gold medal edging Frankie Fredericks in Barcelona
1992 Aug 1,"American sprinter Gail Devers wins an incredibly close blanket finish in the women's 100m at the Barcelona Olympics, with 5 athletes within 0.06 seconds of Devers (10.82)"
1992 Aug 2,"""Death & the Maiden"" closes at Brooks Atkinson NYC after 159 performances"
1992 Aug 2,"Tom Seaver, Rollie Fingers, Hal Newhouser & Bill McGowan are inducted into Baseball Hall of Fame"
1992 Aug 2,American Jacki Joyner-Kersee becomes first athlete to win consecutive gold medals in the gruelling heptathlon with a 199 point win over Irina Belova (Soviet Union) at the Barcelona Olympics
1992 Aug 2,"Vitaly Scherbo of Belarus becomes the first gymnast to win 6 gold medals at one Olympics in Barcelona, also first to win 4 gold in one day's competition (pommel, vault, rings & parallel bars)"
1992 Aug 3,Paramount inaugurates New York Street on TV/movie lot
1992 Aug 3,"""Unforgiven"" directed by Clint Eastwood and starring Clint Eastwood, Gene Hackman and Morgan Freeman premieres in Los Angeles (Academy Awards Best Picture 1993)"
1992 Aug 4,"The diving competition at the Barcelona Olympics concludes with Chinese athletes dominant, winning 3 of 4 gold medals contested - American Mark Lenzi wins 3m springbaord"
1992 Aug 4,"In its debut at the Barcelona Olympics the badminton singles gold medals are both won by Indonesian athletes, whilst both men's & women's doubles go to South Korea"
1992 Aug 4,Italian fencer Giovanna Trillini wraps up gold medals in both women's foil events at the Barcelona Olympics as part of the winning team
1992 Aug 5,"4 officers of the Los Angeles Police Department, acquttied on charges of beating Rodney King, are indicted on civil rights charges"
1992 Aug 5,"Cuba wins baseball's inaugural gold medal at the Olympic Games in Barcelona, beating Chinese Taipei 11-1"
1992 Aug 6,"The US track team sweeps the medals in the long jump at the Barcelona Olympics as Carl Lewis wins gold (28 feet, 5 1/2 inches), Mike Powell silver and Joe Greene bronze"
1992 Aug 6,"Wrestler Bruce Baumgartner becomes the first American to win in three straight Olympics, capturing the gold in the 286-pound freestyle division in Barcelona"
1992 Aug 7,San Francisco Giants announce sale of MLB franchise to group of Tampa Bay investors; move blocked by other investors
1992 Aug 7,The Orlando Magic signs NBA No. 1 draft pick Shaquille O'Neal
1992 Aug 7,"Taking advantage of 6 months training on home town Terrassa pitch, Spain wins their first hockey gold medal beating Germany 2-1 in the women's final at the Barcelona Olympics"
1992 Aug 8,Lou Whitaker hits his 200th career HR
1992 Aug 8,"Metallica band member James Hetfield suffers second and third-degree burns during a pyrotechnics explosion on stage at Olympic Stadium, Montreal"
1992 Aug 8,"The original US 'Dream Team' wins the basketball gold at the Barcelona Olympics 117-85 over Croatia; features superstars Michael Jordan, Magic Johnson, Larry Bird, Scotty Pippen, Charles Barkley, Patrick Ewing"
1992 Aug 8,"Bulgarian canoeist Nikolay Bukhalov completes the C-1 500 / 1,000 double winning the latter at the Barcelona Olympics"
1992 Aug 8,Germany goes through the field hockey competition undefeated to win gold with a 2-1 win over Australia in the men's final at the Barcelona Olympics
1992 Aug 8,"Spanish centre forward Kiko scores twice as the home team takes the football Olympic gold medal with a 3-2 win over Poland in front of 95,000 at Camp Nou, Barcelona"
1992 Aug 8,"Fermín Cacho wins Spain's first ever Olympic gold medal in a running event when he takes out the 1,500m at the Barcelona Games"
1992 Aug 9,"""Streetcar Named Desire"" closes at Ethel Barrymore NYC after 137 performances"
1992 Aug 9,Last day of Test Cricket for David Gower
1992 Aug 9,Record temperature in Berlin-Dahlem 99.3°F (37.4°C)
1992 Aug 9,Future 6-weight boxing world champion Oscar De La Hoya of the US beats German Marco Rudolph on points to win the lightweight gold medal at the Barcelona Olympics
1992 Aug 9,Cuban boxer Félix Savón wins the first of 3 consecutive Olympic heavyweight gold medals when he dominates Nigerian David Izonritei on points at the Barcelona Games
1992 Aug 10, Satellite TOPEX/Poseidon launched
1992 Aug 10, Soyuz TM-15 lands
1992 Aug 11, Oakland A's rip Jose Canseco for leaving stadium before end of game
1992 Aug 12," Canada, Mexico, and the United States announce completion of negotiations for the North American Free Trade Agreement (NAFTA)."
1992 Aug 13, 25th San Diego Comic-Con International opens at Double Tree Hotel
1992 Aug 15, Colombo '92 closes in Genoa Italy
1992 Aug 15, Striker Brian Deane scores both goals for Sheffield United in a season-opening 2-1 home win over Manchester United at Bramall Lane; first of Deane's goals is the first in EPL's inaugural season
1992 Aug 16," Canadian Open Women's Golf (du Maurier Classic), St. Charles CC: American Sherri Steinhauer wins first of 2 majors (British Open 2006) by 3 from Judy Dickinson"
1992 Aug 16," PGA Championship Men's Golf, Bellerive CC: Nick Price of Zimbabwe wins by 3 from John Cook, Nick Faldo, Jim Gallagher & Gene Sauers"
1992 Aug 16," Moses Kiptanui of Kenya runs world 3,000m record 7:28.96 in Cologne, Germany"
1992 Aug 16, British Williams driver Nigel Mansell finishes second in Hungarian Grand Prix at the Hungaroring to clinch his first Formula 1 World Drivers Championship
1992 Aug 17, Hurricane Andrew forms south-east of Barbados in the Caribbean
1992 Aug 17," Kevin Gross of Dodgers tosses only 9-inning no-hitter of season, a 2-0"
1992 Aug 18," ""Real Inspector Hound"" opens at Criterion NYC for 61 performances"
1992 Aug 19, Romesh Kaluwitharana scores 132 on Test Cricket debut (SL v Australia)
1992 Aug 19, Sri Lanka make their highest cricket score ever 8-547 v Australia
1992 Aug 20," England get 7-363 in 55 overs vs Pakistan, then world ODI record"
1992 Aug 21," US Marshals move in on Randy Weaver's cabin in Ruby Ridge, Idaho to apprehend him on firearms charges; an 11 day stand-off ensues"
1992 Aug 22, Matthews & Warne spin Australia to a famous win v Sri Lanka
1992 Aug 22," FBI HRT sniper Lon Horiuchi shoots and kills Vicki Weaver during an 11-day siege at her home at Ruby Ridge, Idaho."
1992 Aug 23," Dennis Eckersley, who previously set record for most consecutive saves (40), is 1st pitcher to record 40 saves in 4 different seasons"
1992 Aug 23," Wilhelm Verwoerd, grandson of former South African Prime Minister, Hendrik Verwoerd, main architect of apartheid, joins the African National Congress"
1992 Aug 24, 1st structural steel beams are erected at Gateway (Jacobs Field)
1992 Aug 24," Cleveland Browns suffer their worst preseason loss, 56-3, to Vikings"
1992 Aug 24," Hurricane Andrew hits South Florida, making landfall at Elliott Key and later Homestead; 44 die and $25 billion in damage is recorded"
1992 Aug 24, Screw magazine superimposed a gunsight over a picture of Larry Flint
1992 Aug 24, Diplomatic relations are established between the People's Republic of China and South Korea.
1992 Aug 25," Jamie Solinger, of Iowa, crowned 10th Miss Teen USA"
1992 Aug 26," ""Anna Karenina"" opens at Circle in Sq Theater NYC for 46 performances"
1992 Aug 26, Hurricane Andrew makes landfall in Louisiana as Category 3 storm after causing deaths and severe damage in Florida
1992 Aug 27, CFL revokes BC Lions franchise
1992 Aug 27, Mets trade David Cone to Toronto for Jeff Kent & Ryan Thompson
1992 Aug 28, Brewers beat Blue Jays 22-2 with AL record 31 hits in 9 innings
1992 Aug 28," Test cricket debut of Muttiah Muralitharan, vs Australia at Colombo"
1992 Aug 29," Largest wrestling crowd outside US (75,000) at Wembley Stadium, London"
1992 Aug 29, Randy Myers blows his 6th save of the season & it marks the 5th time he's blown a potential win for Greg Harris
1992 Aug 29," Brave's Charlie Leibrandt 1,000th strikeout. He decides to keep the ball by rolling it to the dugout, allowing Ricky Jordan to take second base on error."
1992 Aug 30," ""2 Trains Running"" closes at Walter Kerr Theater NYC after 160 performances"
1992 Aug 30," ""Most Happy Fella"" closes at Booth Theater NYC after 229 performances"
1992 Aug 30, 92nd US Golf Amateur Championship won by Justin Leonard
1992 Aug 30," David Lewett & Jane Luu discovers comet: ""1992 QB1"" 64 mil km from Sun"
1992 Aug 31," 44th Emmy Awards: Northern Exposure (best drama & drama writing),Christopher Lloyd (Road To Avalonlea) & Dana Delany (China Beach) win"
1992 Aug 31, Dynamite explosion in a mine in the Philippines kills 500
1992 Aug 31," Howard Stern Radio Show premieres in Cleveland, Ohio on WNCX 98.5 FM"
1992 Sep 1,NYC police commissioner Brown resigns
1992 Sep 1,Tommy Smothers undergoes arthroscopic surgery
1992 Sep 1,"49th Venice Film Festival: ""The Story of Qiu Ju"" directed by Yimou Zhang wins Golden Lion"
1992 Sep 2,Nicaragua struck by earthquake/floodings; 118 die
1992 Sep 2,US dollar valued at 156.50 guilder (record)
1992 Sep 3,"Jerry Lewis' 27th Muscular Dystrophy telethon raises $45,759,368"
1992 Sep 4,"In his record 115th and final US Open singles match, Jimmy Connors is beaten by Ivan Lendl 3-6, 6-3, 6-2, 6-0 in a 2nd-round night match"
1992 Sep 4,"""Scared Silent"" is 1st non news program to be seen on 3 networks simultaneously. (CBS, NBC & PBS), about child abuse hosted by Oprah"
1992 Sep 5,Dan O'Brien sets world record decathlon (8891 pts)
1992 Sep 6,Noureddine Morceli runs world record 1500m (3:28.86)
1992 Sep 7,Army of Ciskei homeland kills 28 ANC demonstrators
1992 Sep 7,Baseball commissioner Faye Vincent resigns
1992 Sep 7,Former owner and team president of the Milwaukee Brewers Bud Selig is appointed interim Commissioner of Major League Baseball; holds office until becoming official Commissioner in 1998
1992 Sep 8,Danny Tartabull has 9 RBIs as Yanks beat Orioles 16-4
1992 Sep 8,Howard Stern Radio Show begins broadcasting in Dallas (KGEL-FM 97.1)
1992 Sep 9,1st time Baltimore Orioles draw 3 million fans at home
1992 Sep 9,9th MTV Video Music Awards: Howard Stern appears as Fartman
1992 Sep 9,"MLB player Robin Yount, is 17th to reach 3,000 hits"
1992 Sep 10, Lucy in Peanuts comics raises her Psychiatric Help from 5 cents to 47 cents
1992 Sep 11," Hurricane Iniki hits Kauai Hawaii; 3 die & 8,000 injured"
1992 Sep 12, Hurricane Inuki pounds Hawaii
1992 Sep 12, STS-47 (Endeavour 2) launches
1992 Sep 12," Stefan Edberg beats Michael Chang 6-7, 7-5, 7-6, 5-7, 6-4 in the longest match in US Open history (5 hours, 26 minutes)"
1992 Sep 12, Mae Jemison is the 1st African American woman to go into space (aboard Endeavour STS-47)
1992 Sep 12," US Open Women's Tennis: Monica Seles retains her title; beats Arantxa Sánchez Vicario of Spain 6-3, 6-3"
1992 Sep 13," NY Giants trailing Dallas Cowboys 34-0 in 3rd, lose 34-28"
1992 Sep 13," US Open Men's Tennis: Stefan Edberg retains his title; beats Pete Sampras 3-6, 6-4, 7-6, 6-2"
1992 Sep 14, 1st subway car completed to be exported from US (to Taiwan)
1992 Sep 15," George Soros' Quantum Fund begins selling large amounts of pound sterling, labelled ""the man who broke the Bank of England"" when pound crashes out of the ERM next day"
1992 Sep 16," ""Les Miserables"" opens at Nuevo Apolo, Madrid"
1992 Sep 16, 900 die in flood in Pakistan
1992 Sep 16, FCC votes to allow competition for local phone service
1992 Sep 16," ""Black Wednesday"" UK government is forced to withdraw the pound sterling from the European Exchange Rate Mechanism after unable keep it above agreed lowest limit"
1992 Sep 17, Theodore (Ted) Weiss wins democratic primary for NYC congressional seat despite having died on 14th
1992 Sep 17, Amsterdam stock exchange hits record Ÿ8.8 billion
1992 Sep 17, House votes 280 to 128 to give FCC control of cable TV rates
1992 Sep 17, NFL decides to suspend World League Football
1992 Sep 19, Sergei Boebka pole vaults world record (6.13m)
1992 Sep 19, UN Security Council votes 12-0 (3 abstentions) to dump Yugoslavia
1992 Sep 19," Barry Bonds joins Willie Mays, Howard Johnson & Ron Gant as having (2) 30-HR/30-steal MLB seasons"
1992 Sep 19," 17th Toronto International Film Festival: ""Strictly Ballroom"" directed by Baz Luhrmann wins the People's Choice Award"
1992 Sep 20, France votes in favor of Maastricht treaty
1992 Sep 20," Leanza Cornett (Florida), 21, crowned 66th Miss America 1993"
1992 Sep 20, Phils' Mickey Moradini makes an unassisted triple play
1992 Sep 20, Space shuttle STS-47 (Endeavour 2) lands
1992 Sep 22," Heavy storm in South France, 34 die"
1992 Sep 23, Bill Comrie purchases BC Lions from CFL
1992 Sep 23, Bradlees announces it will take over Alexander's department stores in NYC
1992 Sep 23, Jackson Browne reportedly beats girlfriend Daryl Hannah
1992 Sep 23, Mud storm kills 30 in South France
1992 Sep 23," 1st female to play in a NHL exhibition game (Manon Rheaume, goalie) for Tampa Bay Lightning - gives up 2 goals on 9 attempts in 1 period"
1992 Sep 24, John Jaha ties record of 11 teammates to steal 10 bases (Brewers)
1992 Sep 24, Scott Stevens is named 5th Captain in NJ Devils history
1992 Sep 24," Toronto's Dave Winfield, 40, is oldest player to reach 100-RBI"
1992 Sep 25," ""Barry Manilow's Showstoppers"" opens at Paramount NYC"
1992 Sep 25," China performs nuclear test at Lop Nor, PRC"
1992 Sep 25, Opening Main-Donau canal (North Sea-Black Sea)
1992 Sep 25, Sparky Anderson ties Hughie Jennings as Detroit's winningest manager
1992 Sep 25, US Mars Observer launched from Space shuttle
1992 Sep 25," Gregory Kingsley, 12, wins right to divorce his parents & live with his foster parents, he takes name Shawn Russ"
1992 Sep 26," Jimmy Connors beats Martina Navratilova, 7-5, 6-3"
1992 Sep 26," Nigerian Air Force Hercules C-130 crashes three minutes after take-off from Lagos, Nigeria, killing 163"
1992 Sep 26, Roseanne Barr Arnold gets a star on Hollywood's Walk of Fame
1992 Sep 26," Tsuruhiko Kiuchi rediscovers Comet Swift-Tuttle, the first time it has been spotted since 1862"
1992 Sep 26," 1st time a positional player pitches for NY Mets, Phil Pecota, in 19-2 lose to Pirates"
1992 Sep 27, ASPCA stops Santeria ceremony in Bronx halts sacrifice of 42 animals
1992 Sep 27, LA Dodgers for 1st time in history clinch last place
1992 Sep 27, Pittsburgh Pirates win their 3rd straight NL East title
1992 Sep 27, Seattle's Randy Johnson ties AL record for lefties with 18 strike outs
1992 Sep 28," ""Barry Manilow's Showstoppers"" closes at Paramount Theater NYC"
1992 Sep 28," ""Dog City"" cartoon debuts on Fox-TV"
1992 Sep 28, Oakland A's win AL West title
1992 Sep 28," Pakistani Airbus A-300 crashes into mountain at Kathmandu, 167 dies"
1992 Sep 29, Atlanta Braves wins 2nd straight NL West title
1992 Sep 29, Magic Johnson announces return to play basketball (he doesn't)
1992 Sep 29, Parliament suspends president Fernando Collor
1992 Sep 30, 26th Country Music Association Award: Garth Brooks wins
1992 Sep 30," KC Royal George Brett gets 4 hits to become 18th to get 3,000 hits"
1992 Sep 30, Mariel Hemmingway appears nude on TV show Civil Wars
1992 Oct 1,"""Oba Oba '93"" opens at Marquis Theater NYC for 22 performances"
1992 Oct 1,Cartoon Cable Network premieres
1992 Oct 1,Greater Pittsburgh International Airport opens
1992 Oct 1,Ross Perot re-enters US presidential race
1992 Oct 1,Gil Stein officially becomes only the 5th president in the NHL's 75 year history; serves for just one year before the title changed to “commissioner”
1992 Oct 2,VP Itamar Franco becomes President of Brazil
1992 Oct 2,"The Carandiru Massacre takes place after a riot in the Carandiru Penitentiary in São Paulo, Brazil"
1992 Oct 3,Atlanta Braves end season with 1-0 victory v San Diego Padres at Atlanta-Fulton County Stadium for franchise record 98th MLB win (old record 95 in 1957)
1992 Oct 3,"Madonna premieres her ""Erotica"" video on MTV"
1992 Oct 3,"Sinead O'Connor rips up a picture of Pope John Paul II on ""Saturday Night Live"""
1992 Oct 4,"""Anna Karenina"" closes at Circle in Sq Theater NYC after 46 performances"
1992 Oct 4,"""Real Inspector Hound"" closes at Criterion Theater NYC after 61 performances"
1992 Oct 4,1st time AL East & West champs have same record (96-66)-Tor & Oak
1992 Oct 4,"Solheim Cup Women's Golf, Dalmahoy CC: Europe beats US, 11½-6½; Laura Davies of England wins all her 3 matches"
1992 Oct 4,"El Al cargo plane crashes at Amsterdam Bijlmer, 43 die"
1992 Oct 4,Miami Dolphin Louis Oliver returns record tying interception 103 yards
1992 Oct 4,The Rome General Peace Accords ends a 16 year civil war in Mozambique.
1992 Oct 5,1st overturn of a George H. W. Bush veto (cable bill)
1992 Oct 5,NY senator Alphonse D'Amato filibusters for 15 hours 20 mins
1992 Oct 5,US Air goes on strike
1992 Oct 7,Tampa Bay Lightning become 1st NHL expansion team to win opener (7-2)
1992 Oct 8,Nobel Prize for literature is given to West Indies poet Derek Walcott
1992 Oct 8,Ottawa Senators 1st NHL game
1992 Oct 8,"Pioneer Venus Orbiter (1st Venus orbiter-1978), crashes into Venus"
1992 Oct 9,Great meteorite seen from Kentucky to New York
1992 Oct 9,"A 13 kilogram (est.) meteorite lands in the driveway of Knapp residence, Peekskill, New York, destroying family's 1980 Chevrolet Malibu"
1992 Oct 9,"Action thriller film ""Under Siege"" directed by Andrew Davis starring Steven Seagal in his most famous role is released"
1992 Oct 10," Floriade (Flower Show) closes at Hague, Netherlands"
1992 Oct 11," 1st three-way US presidential debate (George H. W. Bush, Bill Clinton and Ross Perot)"
1992 Oct 11," Deion Sanders, plays for Atlanta Falcons (NFL) & Braves (Baseball)"
1992 Oct 11, Toronto down 6-1 in 7th beats A's 7-6 in 11th in AL playoff
1992 Oct 12, 5.8 earthquake at Cairo (at least 510 die)
1992 Oct 12, Arecibo radio telescope begins Microwave Observing Project search for occupied planets
1992 Oct 12," Brett ""Hitman"" Hart beats Ric Flair for WWF heavyweight title"
1992 Oct 12, Expo '92 closes in Seville Spain
1992 Oct 12, Howard Stern radio show premieres in Albany NY (WQBK 103.5 & 103.9 FM)
1992 Oct 12, Wash Redskin Art Monk sets NFL record with 820th reception
1992 Oct 14, Toronto Blue Jays beats Oakland A's to win their 1st AL pennant
1992 Oct 14," MLB National League Championship: Atlanta Braves beat Pittsburgh Pirates, 4 games to 3"
1992 Oct 14," MLB American League Championship: Toronto Blue Jays beat Oakland Athletics, 4 games to 2"
1992 Oct 15, Charles Taylor launches an offensive against Monrovia Liberia
1992 Oct 15," Howard Stern radio show begins broadcasting on WLUP-AM, Chicago"
1992 Oct 15," NYC Subway motorman Robert Ray convicted of manslaughter in death of 5 riders, when he fell asleep drunk while in control of train"
1992 Oct 16," 1,700th David Letterman Show"
1992 Oct 16," ""Gilligan's Island"" TV pilot filmed in 1964 is 1st shown on TV (TBS)"
1992 Oct 17, 1st Baseball World Series featuring non-American team; Game 1: Toronto Blue Jays lose 3-1 to Braves at Atlanta–Fulton County Stadium
1992 Oct 18," ""Oba Oba '93"" closes at Marquis Theater NYC after 22 performances"
1992 Oct 18," 1st non-American team to win a Baseball World Series game; Toronto Blue Jays beat Atlanta Braves, 5-4 at Atlanta–Fulton County Stadium"
1992 Oct 18, 6.6 earthquake hits Colombia with no fatalities
1992 Oct 18," Philadelphia Eagle Randall Cunningham sets NFL quarterback scramble record of 3,683"
1992 Oct 18," Start of Zimbabwe's 1st Test match, v India at Harare"
1992 Oct 20," 1st Baseball World Series game is played outside United States; Toronto Blue Jays beat Atlanta Braves, 3-2 in Game 3 at SkyDome in Toronto, Ontario"
1992 Oct 20," David Houghton scores Zimbabwe's 1st Test hundred (121 v India, debut)"
1992 Oct 20," Mr Johnson surrenders Monrovia, Liberia & is exiled to Nigeria"
1992 Oct 21," Madonna's book ""Sex"" goes on sale"
1992 Oct 22," Atlanta Braves become 1st American team to win a Baseball World Series game outside of United States; beat Toronto Blue Jays, 7-2 in Game 5 at SkyDome in Toronto, Ontario"
1992 Oct 22, Space Shuttle STS 52 (Columbia 13) launches into space
1992 Oct 22," Wendy Wasserstein's play ""Sisters Rosensweig"" premieres in NYC"
1992 Oct 23, Emperor Akihito becomes the first Emperor of Japan to stand on Chinese soil
1992 Oct 24," World Series Baseball: Toronto Blue Jays beat Atlanta Braves, 4-3 in Game 6 at Atlanta–Fulton County Stadium to win their first-ever title; MVP: Toronto catcher Pat Borders"
1992 Oct 24, 10th Rugby League World Cup: Australia beats Great Britain 10-6
1992 Oct 25," ""Dancing at Lughnasa"" closes at Plymouth Theater NYC after 421 performances"
1992 Oct 25," ""Jake's Women"" closes at Neil Simon Theater NYC after 245 performances"
1992 Oct 25, Rene Lachemann hired as Fla Marlins 1st manager
1992 Oct 25, Lithuania holds a referendum on its first post-Soviet constitution.
1992 Oct 26, The Charlottetown Accord fails to win majority support in a Canada wide referendum.
1992 Oct 26, London Ambulance Service thrown into chaos after implementation problems with a new Computer Aided Dispatch (CAD) system
1992 Oct 27, Don Baylor appointed 1st manager of Colorado Rockies
1992 Oct 27," Fox is to launch Tuesday night network TV, rescheduled to Decemeber"
1992 Oct 27, Great Britain issues postage stamp on 100th anniversary of JRR Tolkien
1992 Oct 27, Tipper Gore (wife of future VP) admits to covering clock on her VCR with black tape so she wouldn't have to watch it blink
1992 Oct 28, Lee Jang Rim predicts that today would be the end of the world!
1992 Oct 30, MTA begins installing automated fare collection turnstiles
1992 Oct 31," Don Keller makes his 18,000th sky dive"
1992 Oct 31, Roman Catholic church reinstates Galileo Galilei after 359 years
1992 Oct 31," Breeders' Cup Horse Racing, Gulfstream Park; winners: A P Indy, Fraise, Gilded Time, Liza, Lure, Paseana, Thirty Slews"
1992 Nov 1,"New York City Marathon: Willie Mtolo of South Africa wins men's race, 2:09:29; Australian Lisa Ondieki women's champion, 2:24:40"
1992 Nov 1,"NY Jets wide receiver Al Toon becomes 10th NFL player to make a reception in 100 straight games; Jets beat Miami Dolphins, 26-24 at The Meadowlands"
1992 Nov 1,Space Shuttle STS 52 (Columbia 13) lands (scheduled)
1992 Nov 2,First test flight of Airbus A330
1992 Nov 3,"Democrat Bill Clinton is elected President of the United States, defeating incumbent President George H. W. Bush"
1992 Nov 3,"Carol Moseley-Braun elected first African-American woman in US Senate, representing Illinois"
1992 Nov 3,"""I Will Always Love You"" (Dolly Parton cover) single released by Whitney Houston (Billboard Song of the Year 1993)"
1992 Nov 3,"Rock band Rage Against the Machine release their debut album ""Rage Against the Machine"" featuring single ""Killing in the Name"""
1992 Nov 4,NY Giants announce they will quit WNEW Radio after 32 years for WOR
1992 Nov 4,NY Jets announce they are moving from WABC to WFAN radio
1992 Nov 5,"""Show Off"" opens at Criterion Theater NYC for 45 performances"
