2020 Mar 19," Italian death toll from COVID-19 at 3,405 surpasses China's official total (3,245) making it then the worst-affected country in the world"
2020 Mar 19," State of California with 910 cases of COVID-19 locks down and orders people to ""stay at home"""
2020 Mar 19, Professional football in England is further postponed until 'no earlier than 30 April' due to the COVID-19 pandemic
2020 Mar 20," India hangs four men for 2012 gang rape and murder of woman on a bus in New Delhi, country's first hanging since 2013"
2020 Mar 20," After 20 years with the New England Patriots, six-time Super Bowl winning quarterback Tom Brady officially agrees to move to the Tampa Bay Buccaneers on a 2-year $50m guaranteed deal"
2020 Mar 20," Smoke from Australian bushfires killed more people than the fires - 417 vs 33 according to new study published in ""Medical Journal of Australia"""
2020 Mar 21," Italy records record daily death toll of 793 for COVID-19 as the worldwide death tolls surpasses 12,000 with 299,000 known infections (Johns Hopkins figures)"
2020 Mar 22, India puts 1 billion people under a daytime curfew to curb COVID-19
2020 Mar 22," Iranian supreme leader Ayatollah Ali Khamenei refuses American COVID-19 help, refers to conspiracy theory that it was manufactured by the US"
2020 Mar 23," New York confirmed as new center of the COVID-19 pandemic in the US with 20,875 cases (5,707 in the last day) and 157 deaths"
2020 Mar 23, Immediate global ceasefire to fight COVID-19 called for by UN Secretary General Antonio Guterres
2020 Mar 23," WHO says the COVID-19 pandemic is accelerating, 1st 100,000 cases took 67 days, 2nd 100,000 cases 11 days, 3rd 100,000 cases 4 days"
2020 Mar 23, COVID-19 lockdowns imposed in South Africa and the United Kingdom while other European nations extend and strengthen their lockdowns
2020 Mar 23," African American Daniel Prude dies after being physically retrained by police in Rochester, New York, including having a hood put over his head"
2020 Mar 24, Indian PM Narendra Modi orders a 21 day lockdown for world's second most populous country of 1.3 billion people to deal with COVID-19
2020 Mar 24, Japan's Prime Minister Shinzō Abe announces postponement of Tokyo 2020 Olympic and Paralympic Games until summer of 2021 because of the worldwide COVID-19 pandemic
2020 Mar 24," China's Hubei province, the original center of the COVID-19 outbreak eases restrictions on travel after a nearly two-month lockdown"
2020 Mar 25, United Kingdom's Prince Charles tests positive for COVID-19
2020 Mar 25," Spain's death toll from COVID-19 overtakes China's at 3,434 to become then second worldwide behind Italy with 7,503 deaths with a worldwide toll of 20,836"
2020 Mar 26," American cases of COVID-19 exceed all other countries on this date, with 81,578 cases and 1,180 deaths (New York Times)"
2020 Mar 26, Record number of Americans file for unemployment - 3.3 million according to US Department of Labor
2020 Mar 26," US charges Venezuelan president Nicolás Maduro and other officials with ""narco-terrorism"", by flooding the US with drugs"
2020 Mar 26, Christchurch mosque gunman Brenton Tarrant pleads guilty to all 51 murders in New Zealand
2020 Mar 27," UK Prime Minister Boris Johnson announces he has contracted COVID-19 but will continue to lead the country ""thanks to the wizardry of modern technology"" while in self-isolation"
2020 Mar 27," $2.2 trillion stimulus package, largest in US history, signed into law by President Donald Trump saying ""I never signed anything with a 'T' on it"""
2020 Mar 28," US President Donald Trump makes grim projection that 240,000 American could die from COVID-19, even with restrictions in place"
2020 Mar 29, Nigerian President Muhammadu Buhari orders a lockdown in the cities of Lagos and Abuja after the country records 97 COVID-19 cases and one death
2020 Mar 29," US infectious disease expert Anthony Fauci warns America may see between 100,000 - 200,000 deaths from COVID-19"
2020 Mar 30, Russian city Moscow begins a city-wide lockdown after 4 hours notice due to COVID-19
2020 Mar 30," Three out of four Americans now ordered to stay home due to COVID-19 as states of Virginia, Maryland, Arizona and Florida issue lockdowns"
2020 Mar 30, International Olympic Committee announces postponed 2020 Summer Olympic Games will be held July 23-August 8 in 2021 because of the COVID-19 pandemic
2020 Mar 31, British pensioner Robert Weighton becomes the world's oldest man at 112 years
2020 Apr 1,All England Lawn Tennis Club cancels Wimbledon for the first time since World War II because of the COVID-19 pandemic; entire grass-court season abandoned
2020 Apr 1,US President Donald Trump says the US Strategic National Stockpile is almost depleted amid widespread shortages of medical equipment to fight COVID-19
2020 Apr 2,"Record 6.6 million Americans filed claims for unemployment in last week according to the US Department of Labor, 10 million over 2 weeks"
2020 Apr 2,"Number of COVID-19 cases worldwide passes 1 million, with 1,002,159 cases and 51,485 deaths reported, according to Johns Hopkins University"
2020 Apr 2,"Brazilian president Jair Bolsonaro downplays the COVID-19 pandemic saying ""its not all its being made out to be"""
2020 Apr 2,"Spain's death toll passes 10,000 (10003), as it posts a record single-day rise of 950 deaths"
2020 Apr 2,"New study shows western Antarctica once swampy with temperate forests 93-83 million years ago during Cretaceous period, according to Alfred Wegener Institute"
2020 Apr 3,US aircraft carrier captain Brett Crozier cheered off his ship after being fired for a letter demanding more help for his sailors infected with COVID-19
2020 Apr 3,"London's Nightingale hospital opened by Prince Charles (remotely) after nine days with 4,000 beds to treat COVID-19 patients at the ExCeL Centre"
2020 Apr 3,27 people swept off a ferry and feared dead in the Solomon Islands during Cyclone Harold
2020 Apr 4,"WrestleMania XXXVI, WWE Performance Center, Orlando FL, Part 1: The Undertaker defeats AJ Styles in a Boneyard match; Becky Lynch beats Shayna Baszler to retain Raw Women's C'ship"
2020 Apr 5,"British monarch Queen Elizabeth II makes an address to the nation “we will meet again”, for only the 5th time in her 66-year reign"
2020 Apr 5,British Prime Minister Boris Johnson admitted to hospital suffering from COVID-19
2020 Apr 5,"WrestleMania XXXVI, WWE Performance Center, Orlando FL, Part 2: Drew McIntyre defeats Brock Lesnar to win the WWE C'ship; Charlotte Flair beats Rhea Ripley for NXT Women's title"
2020 Apr 6,Japanese Prime Minister Shinzō Abe announces state of emergency in seven prefectures and a nearly $1 trillion stimulus package as COVID-19 cases climb
2020 Apr 6,"Nadia, a tiger at the Bronz Zoo, tests positive for COVID-19, 1st known case of human-to-cat transmission"
2020 Apr 6,"US COVID-19 death toll passes 10,000 in six weeks, with more than 356,000 American infected, New York death toll reaches 4,758"
2020 Apr 6,149th British Open Men's Golf Championship is cancelled for the first time since WWII due to the COVID-19 pandemic; Royal St George's GC to host event in 2021
2020 Apr 6,"Cyclone Harold makes landfall in Vanuatu, leaving thousands of houses destroyed and 2 dead"
2020 Apr 7,"China ends its lockdown of Wuhan, the city at the center of the COVID-19 pandemic after 76 days as the country reports no new deaths for the 1st time"
2020 Apr 7,Australia's highest court overturns the child sexual abuse conviction of Catholic Cardinal George Pell
2020 Apr 7,"US acting Navy Secretary Thomas Modly resigns after calling Capt. Brett Crozier of the USS Thomas Roosevelt ""too naive and too stupid"" in address to the crew"
2020 Apr 7,"Wisconsin holds its Democratic primary with in-person voting in the midst of the COVID-19 pandemic, after a mail-in voting rejected by the Wisconsin Legislature"
2020 Apr 8,Bernie Sanders drops out of the Democratic race for US president
2020 Apr 8,Saudi-backed coalition fighting Houthi fighters in Yemen calls for a ceasefire after five years to stop the spread of COVID-19
2020 Apr 8,"World Trade organization predicts a drop in global trade greater than the 2008 financial crisis, between 13% and 32% for 2020"
2020 Apr 11," Brazil is the 1st country in the southern hemisphere to report more than 1,000 deaths from COVID-19, with 1,056 deaths and 19,638 cases"
2020 Apr 12, OPEC and other major oil companies agree to the largest-ever drop in production to stabilize world prices
2020 Apr 12, Pope Francis calls for the world to be united in the face of COVID-19 as he delivers his Easter message from an empty St Peter's Cathedral in Rome
2020 Apr 12, Huge storm system produces more than 40 tornadoes in the US from Texas to South Carolina killing 32 people across six states
2020 Apr 13, Bernie Sanders endorses former rival Joe Biden for president
2020 Apr 13, Italian tenor Andrea Bocelli sings a special Easter concert in the deserted Milan cathedral accompanied by an organist
2020 Apr 13," NY Governor Andrew Cuomo says “I believe the worst is over if we continue to be smart,” about the COVID-19 pandemic in New York as death toll passes 10,000"
2020 Apr 14, Former President Barack Obama endorses his former Vice President Joe Biden for president
2020 Apr 14, PM Narendra Modi extends India's COVID-19 lockdown until May 3
2020 Apr 14, Parts of Europe begin to ease lockdown restrictions after 5-6 weeks with some shops opening in Austria and parts of Italy
2020 Apr 14," IMF warns the global economy expected to contract by 3% in 2020 due to COVID-19 ""Great Lockdown"", steepest downturn since the Great Depression"
2020 Apr 14," US President Donald Trump freezes funding for the World Health Organization pending a review, for mistakes in handling the COVID-19 pandemic and for being ""China-centric"", prompting international criticism"
2020 Apr 15," South Korea is 1st country to hold a general election under COVID-19, President Moon Jae-in's ruling Democratic party wins in a landslide"
2020 Apr 15," Revised death count for New York taking into account assumed COVID-19 deaths makes the city's per-capita death rate higher than Italy at 10,367 at this date"
2020 Apr 15," US's deadliest day during COVID-19 pandemic with 2,752 deaths reported"
2020 Apr 16," New study claims a multi-decade megadrought is already under way in the western US, published in journal ""Science"""
2020 Apr 16, Nationwide State of Emergency declared in Japan till 6 May due to the worsening COVID-19 outbreak
2020 Apr 16," 22 million Americans have filed for unemployment in 4 weeks (5.2 million in the last week), wiping out 9 1/2 years of job gains"
2020 Apr 17," WHO warns Africa could be next epicenter of the COVID-19 pandemic, with over 300,000 deaths, pushing 30 million into poverty as it records nearly 1000 deaths and 19,000 cases to date"
2020 Apr 18," French flagship aircraft carrier Charles de Gaulle reports over 1,000 cases of COVID-19, prompting an investigation"
2020 Apr 18," Canada's worst modern mass shooting as a gunman kills 18 people, including a Royal Canadian Mounted Police officer, across Nova Scotia"
2020 Apr 19, Together At Home concert for COVID-19 aid curated by Lady Gaga and streamed worldwide
2020 Apr 19," US COVID-19 death toll passes 40,000, with 742,442 cases recorded according to Johns Hopkins tally"
2020 Apr 19," UK COVID-19 death toll reaches 16,060 (hospitals only), as ""The Sunday Times"" criticizes Boris Johnson's government's response, saying they ""sleepwalked into disaster"""
2020 Apr 19," Turkey passes Iran to become the Middle Eastern country with the most COVID-19 cases with 86,306 infections, Iran continues to have the most deaths"
2020 Apr 20," Three US states, Georgia, Tennessee and South Carolina the 1st to announce end to some COVID-19 restrictions"
2020 Apr 20," Price of US oil turns negative for the 1st time in history - West Texas Intermediate, the benchmark for US oil, falls as low as minus $37.63 a barrel as worldwide demand falls"
2020 Apr 20," The last three cruise ships still afloat around the world dock finally dock at the ports of Marseille, Barcelona and Los Angeles"
2020 Apr 21, US President Donald Trump announces new 60-day ban on most green cards for the US
2020 Apr 21," At least 25,000 extra people across 11 countries have died during COVID-19 pandemic that were not previously counted according to new mortality figures"
2020 Apr 21," South African president, Cyril Ramaphosa announces $26 billion aid package and plans for gradual reopening of economy as cases reach 3,465 with 58 deaths"
2020 Apr 21," Health Secretary Matt Hancock and UK government come under criticism for lack of personal protective equipment and testing for COVID-19 (despite pledge to test 100,000 a day only 19,000 done April 20th)"
2020 Apr 21," Mexico says it is entering stage three of its COVID-19 outbreak, with rapid spread and hospitalizations from 8,772 infections and 712 deaths"
2020 Apr 22, Sudan bans female genital mutation and makes it a criminal offense
2020 Apr 23," First findings of a frog fossil 40 million years old, found on Seymour Island, Antarctica (2015) published in ""Scientific Reports"""
2020 Apr 23," Ecuador's COVID-19 death toll is then one of world's highest per capita after 7,600 more deaths than usual (503 official toll), in report by ""The New York Times"""
2020 Apr 23," German Chancellor Angela Merkel warns this is ""not the end phase but still just the beginning"" of the COVID-19 pandemic"
2020 Apr 23, NFL Draft: LSU quarterback Joe Burrow first pick by Cincinnati Bengals
2020 Apr 23, US President Donald Trump suggests COVID-19 might be treated by injecting disinfectant or UV lights into a human body at a White House press briefing. Government officials and disinfectant companies quickly state doing so is not only extremely dangerous but potentially deadly.
2020 Apr 27," Global confirmed cases of COVID-19 pass 3 million with the death toll at 205,000. US has 1/3 of all new cases."
2020 Apr 28," US confirmed cases of COVID-19 pass 1 million, while death toll of 58,365 surpasses that of US soldiers killed in Vietnam War (Johns Hopkins)"
2020 Apr 28, US Department of Defense releases three declassified videos of possible UFOs from 2004 and 2015
2020 Apr 28," President Vladimir Putin warns Russia has not yet reached the peak of COVID-19 infections, with 93,000 recorded cases and 867 deaths"
2020 Apr 28, Argentina bans all commercial domestic and international flights until September 1 because of COVID-19
2020 Apr 29, A mile-wide asteroid named 1998 OR2 passes within 3.9 million miles of Earth
2020 Apr 29," US GDP falls 4.8% for the financial quarter, officially ending the country's growth streak. Worst contraction since 2008."
2020 Apr 29," UK official death toll reaches 26,000 deaths from COVID-19 as care home and community deaths included"
2020 Apr 29," Fire at an Icheon warehouse, South Korea, kills 38"
2020 Apr 30, Russian Prime Minister Mikhail V. Mishustin says he has COVID-19
2020 Apr 30," South Korea reports no new domestic cases of COVID-19 for 1st time, their virus cases peaked Feb 29"
2020 Apr 30," British Captain Tom Moore, who raised more £30 million for the National Health Service walking in his garden, turns 100 and made an honorary colonel by the Queen"
2020 Apr 30," Eurozone economy shrinks at -3.8% between Jan and Mar 2020, the fastest rate on record with Euro Bank President Christine Lagarde warning the 2nd quarter will be even worse"
2020 Apr 30, UK PM Boris Johnson says Britain is past the peak of the COVID-19 outbreak
2020 Apr 30," US President Donald Trump claims COVID-19 originated in a lab in Wuhan, while the Office of the Director of National Intelligence saying the virus is not manmade"
2020 May 1,"Prison riot leaves more than 40 dead and many injured at Los Llanos jail, near Guanare city, Venezuela"
2020 May 1,"Canadian PM Justin Trudeau announces ban on 1,500 types of assault-style weapons in response to recent Nova Scotia shooting"
2020 May 1,Tweets by Elon Musk saying Tesla's share price is too high wipe $14 billion off the carmaker's value
2020 May 1,"Armed protesters against stay-at-home-orders gather at the State Capitol in Lansing, Michigan, as Governor Gretchen Whitmer reinstates State of Emergency"
2020 May 2,"Hafþór Júlíus Björnsson, the Icelandic actor who played Ser Gregor ""The Mountain"" Clegane in Game of Thrones, sets a world deadlifting record by lifting 501kg (1,104lb)"
2020 May 3,US Secretary of State Mike Pompeo says China responsible for the spread and severity of COVID-19 and should be held accountable
2020 May 3,"Investor Warren Buffett dumps his holdings in four major US airlines saying ""the world has changed"" for aviation, reflecting an increasingly bleak outlook for the industry"
2020 May 3,"Brazilian confirmed COVID-19 cases pass 100,000 with the death toll at 7,025, the 9th country to do so"
2020 May 4,"Countries in Europe begin cautious reopening after COVID-19 lockdown, Italy restarts construction and takeaways, Germany reopens schools"
2020 May 4,"World leaders pledge $8 billion to research treatments and a vaccine for COVID-19, with the US and Russia not taking part"
2020 May 4,India begins lifting some restrictions in regions with fewer COVID-19 cases
2020 May 5,"Global confirmed cases of COVID-19 reach 3.65 million, US cases pass 70,000 while the UK becomes the most affected in Europe with 29,427 known deaths"
2020 May 5,"São Luis, in Maranhão state becomes the first Brazilian city to enter lockdown because of COVID-19 as its health services struggle to cope"
2020 May 6,"UK becomes the first European country to report over 30,000 confirmed cases of COVID-19"
2020 May 6,"Irish organisation repays a 170 year old favor, raising over $2 million (to date) for US Navajo Nation and Hopi Reservation badly affected by COVID-19. In 1840s Choctaw Nation sent $170 to aid Irish potato famine."
2020 May 6,"At least 90,000 healthcare workers worldwide infected by COVID-19, more than 260 nurses have died according to International Council of Nurses"
2020 May 6,"Former intelligence chief Mustafa al-Kadhimi sworn in as new Iraqi Prime Minister, 3rd to be nominated in six months"
2020 May 7,"UK economy heading for its' worst crash in 300 years (-14%), since 1706, according to Bank of England forecast"
2020 May 7,"US Father and son arrested for the murder of Ahmaud Arbery in Brunswick, Georgia, after video of the killing surfaces"
2020 May 7,Toxic leak at Indian chemical factory near Visakhapatnam kills at least 13 and injures many when it tried to reopen after lockdown
2020 May 7,"US unemployment claims hit 33.3 million or 20% of the workforce, vs two months ago unemployment 3.5%, a 50-year low"
2020 May 8,Two US White House staffers test positive for COVID-19 and three members of the coronavirus task force go into self-isolation after possible exposure to the virus
2020 May 8,11-year old Brazilian skateboarder Gui Khury creates world record by performing 1st 1080 degree turn on a vertical ramp
2020 May 10," Global confirmed cases of COVID-19 rise above 4 million with death toll above 270,000, according to Johns Hopkins"
2020 May 11," Colombian airline Avianca, and world's 2nd oldest, becomes 1st major airline to file for bankruptcy"
2020 May 11, World Health Organization warns “extreme vigilance” needed as many countries begin easing lockdowns
2020 May 12," Russia's confirmed cases of COVID-19 reach 232,000, 2nd highest in the world, a day after President Vladimir Putin eased the country's lockdown"
2020 May 12," Militants storm a hospital and a funeral in Kabul, Afghanistan, shooting an estimated 40 people dead including new mothers and their babies"
2020 May 12," US coronavirus task force testifies to the Senate that the US ""is not out of the woods yet"" that the pandemic is not under control and risks surge in cases if reopens too soon"
2020 May 12," Indian Prime Minister Narendra Modi announces a $260 million economic rescue package, worth 10% of GDP"
2020 May 12," Wuhan, epicenter of the COVID-19 outbreak, draws up plans to test all 11 million residents after it records a new cluster of 6 cases"
2020 May 13, Every African country now has cases of COVID-19 as Lesotho becomes the last county on the continent to record a case
2020 May 14," Former pandemic agency head Rick Bright testifies to a US House Committee ""without better planning, 2020 could be the darkest winter in modern history"""
2020 May 14," Global death toll from COVID-19 passes 300,000 with 4.4 million confirmed infections"
2020 May 15," Germany, Europe's largest economy, officially in recession due to COVID-19, as figures show economy shrank 2.2% 1st 3 months of 2020"
2020 May 16, 118-year old American department store JC Penney files for bankruptcy
2020 May 17," Israel swears in a new government led by both Benny Gantz, and Prime Minister Benjamin Netanyahu after 510 days"
2020 May 17," Michael Jordan's autographed Air Nike 1s trainers from 1985 sell for a record $560,000 in an online auction"
2020 May 17," Barack Obama criticizes the US government's handling of the pandemic during an online address to graduates, saying officials ""aren't even pretending to be in charge"""
2020 May 18, US President Donald Trump confirms he is taking controversial drug hydroxychloroquine against Covid-19
2020 May 19," WHO member states agree to set up an inquiry into the global response to the pandemic, including looking at the WHO itself"
2020 May 19," Greenhouse gas emissions dropped 17% worldwide in April 2020 when world was in lockdown, in study published in ""Nature Climate Change"""
2020 May 19," Two dams on Tittabawassee River in central Michigan breached by floodwaters, forcing evacuation of thousands of residents"
2020 May 20," WHO reports most new cases in a single day - 106,000 worldwide of COVID-19"
2020 May 20," Cyclone Amphan comes ashore in West Bengal, East India and Bangladesh, with winds of 185 km per hour (115 mph) killing at least 84 people"
2020 May 22, China unveils new national security legislation against Hong Kong at its annual legislative session
2020 May 22, Pakistan International Airlines flight crashes near Jinnah International Airport in Karachi killing 97 with just two survivors
2020 May 24," The New York Times prints front page with nearly 1,000 names of people who have died from COVID-19, as the US toll nears 100,000"
2020 May 24," Millions of cicadas in a once in 17-year event about to emerge from the earth in the US south posing crop danger and noise issues, according to scientists from Virginia Tech"
2020 May 24," British PM Boris Johnson refuses to sack his senior aide Dominic Cummings, after it is revealed he broke the country's lockdown rules to drive across the country"
2020 May 25," Video of African American George Floyd's arrest and murder while restrained in Minneapolis police custody shows he was pinned to the ground by police officer Derek Chauvin's knee for 8 minutes and 46 seconds, ignites widespread condemnation and nationwide protests"
2020 May 26, Costa Rica becomes the first county in Central America to legalize same-sex marriage
2020 May 26, US restricts travel from Brazil as the country posts world's second highest number of recorded cases of COVID-19
2020 May 26," J. K. Rowling begins publishing children's story ""The Ickabog"" online in installments"
2020 May 26, Twitter adds warning labels to warn about inaccuracies in US President Donald Trump's tweets for the first time
2020 May 27," America's COVID-19 death toll passes 100,000 (Johns Hopkins figures) equal to number of US servicemen and women killed in Korea, Vietnam, Iraq and Afghanistan put together"
2020 May 27," Spain begins 10 days of mourning for victims of COVID-19 with death toll just under 27,000"
2020 May 27," US Secretary of State Mike Pompeo says Hong Kong no longer has autonomy from China, doesn't merit special trade relationship, in note to Congress"
2020 May 27, Locust swarms in western and central India worst since 1993 after spreading from Pakistan and Iran and due to extreme weather
2020 May 28, Minnesota Governor Tim Walz declares State of Emergency in Minneapolis and activates the Minnesota National Guard after protests over the death of George Floyd in police custody
2020 May 28, Iranian President Hassan Rouhani calls for new protections for women after the 'honor killing' of a 14-year old by her father
2020 May 30," Record number of COVID-10 cases reported worldwide 134,064, driven by hot spots in Brazil, Peru, Egypt, South Africa and Bangladesh"
2020 May 30, SpaceX's Falcon 9 rocket launches carrying the Dragon capsule from Cape Canaveral to the International Space Station. First private company to launch astronauts into space.
2020 Jun 1,US President Trump threatens to employ the military to quell protests across the country sparked by the death of George Floyd then walks with staff to St. John’s Church
2020 Jun 2,"New outbreak of Ebola has killed five people in city of Mbandaka, Democratic Republic of Congo"
2020 Jun 2,"Brazilian death toll passes 30,000 from COVID-19 at 31,199 with 555,383 number of cases confirmed, 2nd only to the US"
2020 Jun 2,"UN human rights chief, Michelle Bachelet says pandemic exposing ""endemic inequalities"" around the world, cites death of George Floyd and higher death toll for ethnic minorities"
2020 Jun 2,"UK death toll from COVID-19 passes 50,000 (50,032) according to its Office of National Statistics"
2020 Jun 3,"Three former police officers charged in connection with death of George Floyd in Minneapolis, Derek Chauvin's charge upgraded to second degree murder"
2020 Jun 3,"Former Defense Secretary James Mattis says in The Atlantic: ""Donald Trump is the first president in my lifetime who does not try to unite the American people — does not even pretend to try. Instead, he tries to divide us."""
