2020 Jun 4,Thousands ignore a recent ban and mark the anniversary of Tiananmen Square Massacre in Hong Kong
2020 Jun 4,"UN report criticizing human rights violations in the Philippines, including deaths of 8,000 during its war on drugs, a day after county's House of Representatives passed new anti-terrorism law"
2020 Jun 4,"Memorial for George Floyd led by Rev. Al Sharpton, killed in police custody, in Minneapolis, as 10th night of protests at his death held around the country"
2020 Jun 4,"State of Emergency declared after 20,000 tonnes of diesel oil spills near Russian city of Norilsk, Siberia within the Arctic Circle"
2020 Jun 7,US National Guard pulled out of Washington D.C. and curfew ends in New York as anti-racism protests stay largely peaceful
2020 Jun 7,"Black Lives Matter Protests continue worldwide in large numbers, In Bristol England statue of 17th century slave trader Edward Colston pulled down"
2020 Jun 7,"COVID-19 global death toll passes 400,000 with confirmed cases at 6,973,195 according to Johns Hopkins figures"
2020 Jun 8,"New York begins reopening after 100 days of lockdown due to COVID-19 with just 702 hospitalized (18,825 at peak of outbreak)"
2020 Jun 8,"National Bureau of Economic Research announces the US officially entered recession in February, ending the longest expansion of growth since 1854 (11 years)"
2020 Jun 8,World Bank says the COVID-19 pandemic will shrink the global economy by 5.2% in 2020
2020 Jun 8,The Philippines says children won't go back to school until a vaccine is found for COVID-19
2020 Jun 8,Former astronaut Kathy Sullivan is the first woman to reach deepest point of the ocean - Challenger Deep in the Marianas Trench. Formerly the first American woman to spacewalk.
2020 Jun 8,Lockdowns for COVID-19 in Europe saved 3 million lives according to study by Imperial College London
2020 Jun 9,"US Senate confirms General Charles Q. Brown as Air Force Chief of Staff, 1st African American to lead a US armed forces branch"
2020 Jun 10," Swedish prosecutors close the case on the murder of Prime Minister Olof Palme after 34 years, saying the probable killer is dead"
2020 Jun 10, Cameroon's conflict with English-speaking separatists rated world's most-neglected conflict according to Norwegian Refugee Council
2020 Jun 10," Statues of Confederate figures and explorers become focus of #BlackLivesMatter protests, with many removed including of Confederate President Jefferson Davis and of Christopher Columbus in Richmond"
2020 Jun 11, Bodies of 46 migrants recovered off the coast of Tunisia after a boat capsized a few days before
2020 Jun 11," Pan-American Health Organisation warns pandemic spreading ""exponentially"" in many areas of the region, home to nearly half of all cases worldwide"
2020 Jun 12, African American Rayshard Brooks shot dead in drive-through carpark in Atlanta leading to further protests at police violence and the resignation of city's police chief
2020 Jun 14," India reports surge of nearly 12,000 a day confirmed COVID-19 cases (320,922 overall), the world's fourth-affected country, as death toll hits 9,195"
2020 Jun 15, Philippines journalist and 'Time Person of the Year' Maria Ressa found guilty of cyber libel in Manila amid claims charges politically motivated
2020 Jun 15, New COVID-19 cluster of more than 100 cases in Beijing called a 'significant event' by WHO
2020 Jun 15, In landmark decision US Supreme Court rules 6-3 that gay and transgender workers cannot be discriminated against in the workplace
2020 Jun 16," At least 20 Indian soldiers killed in 1st deadly clash on the Chinese Indian border in 45 years in the Galwan Valley, Himalayas"
2020 Jun 16, Support from Manchester United player Marcus Rashford and others forces UK Government to make U-turn on summer school meal vouchers
2020 Jun 17, Former police officer who shot Rayshard Brooks in Atlanta charged with his murder and aggravated assault
2020 Jun 17, First major breakthrough in treating COVID-19 using steroid dexamethasone announced by Oxford University
2020 Jun 17, Actor Danny Masterson charged with raping three women
2020 Jun 18," US Supreme Court rules the Obama-era Dreamers Program (DACA), enabling undocumented migrant children ability to study and work, can stay"
2020 Jun 18," Global COVID-19 death toll passes 450,000 (451,118) with 8,421,357 cases known according to Johns Hopkins figures"
2020 Jun 18," Canadian coronavirus COVID-19 known cases pass 100,000 with 8,361 deaths"
2020 Jun 19, Australian government and companies suffer a months-long state-based cyber attack according to PM Scott Morrison
2020 Jun 20," Donald Trump controversially holds his first re-election rally in Tulsa, Oklahoma, only 6,200 people attend despite the campaign stating 1 million had registered. Social media campaign organised by teens on TikTok, K-Pop fans and others, claims responsibility for wildly inflating the expected attendance."
2020 Jun 20," Highest-ever temperature recorded in the Arctic circle, 38C (100F) in Verkhoyansk, Siberia"
2020 Jun 20," Three men stabbed to death, with three others injured, in a terrorist attack in a park in Reading, England"
2020 Jun 20," Historic dust cloud from the Sahara desert reaches the Caribbean, largest for half a century"
2020 Jun 21, Kurt Cobain's guitar during Nirvana's MTV Unplugged show sells for a record $6 million
2020 Jun 21," WHO records a new record number of new daily cases of COVID-19 - 183,020, with 116,000 coming from North and South America"
2020 Jun 21," New archaeological discovery announced near Stonehenge of a large circle of shafts surrounding a village 2500 BC, largest prehistoric structure in Britain"
2020 Jun 21, Saudi Arabia bans international visitors from making the Islamic Hajj pilgrimage in 2020 due to COVID-19
2020 Jun 22, Japanese supercomputer Fugaku in Kobe by Riken institute wins world contest to be the fastest
2020 Jun 22," New York City, once the epicentre of the pandemic in America, begins stage 2 of re-opening, allowing outdoor dinning and some in-store shopping"
2020 Jun 22, US government data shows African Americans four times more likely than whites to be hospitalized for COVID-19 highlighting racial disparities for the pandemic
2020 Jun 22," Brazil becomes second country to pass 50,000 deaths (officially) with states of Amazonas, Pará, Ceará, São Paulo and Rio de Janeiro most effected."
2020 Jun 23," Germany locks down a second area after a spike in COVID-19 cases in Gütersloh and Warendorf, North Rhine-Westphalia, affecting half a million people"
2020 Jun 23," COVID-19 cases rise sharply again in America as country records its 3rd highest daily total, more than 35,000"
2020 Jun 23, 125 pilots grounded by Pakistan International Airlines after revelations many had cheated in exams or held fake licenses
2020 Jun 24, NY Governor Andrew Cuomo announces people arriving from nine states hard-hit by the COVID-19 pandemic will have to isolate for two weeks
2020 Jun 24," COVID-19 pandemic worsens dramatically in Yemen, the Arab world's poorest country, with 25% mortality according to the UN"
2020 Jun 24, Russia celebrates its victory 75 years ago over Nazi Germany with huge military parade through Red Square in Moscow (delayed from May 9 due to pandemic)
2020 Jun 24," World Monetary fund predicts a deeper global recession with contraction of 4.9% (down from 3%), noting 2/3 of all countries used 11 trillion to support their economies"
2020 Jun 25," WHO declares the Ebola outbreak in the Congo over. The Second worst outbreak it killed 2,280 people over 2 years"
2020 Jun 25," US Center of Disease Control estimates 20 million people in America have been infected with COVID-19, 10 times higher than confirmed cases"
2020 Jun 25," Australian airline Qantas announces it is cutting 6,000 jobs, a fifth of its workforce because of the pandemic"
2020 Jun 25," American country music band ""The Dixie Chicks"" change their name to ""The Chicks"" to remove connotations of Confederate history, two weeks after band ""Antebellum"" changed their name to ""Lady A"""
2020 Jun 25," Liverpool FC clinches first EPL soccer title in 30 years with 7 games to spare as Chelsea beats second-placed Manchester City, 2-1 at Stamford Bridge"
2020 Jun 26, New York Times says Russia secretly offered bounties to Taliban-linked forces to kill US and coalition troops in Afghanistan
2020 Jun 27, Ireland's coalition government appoints Micheál Martin as Prime Minister after four months of negotiations
2020 Jun 27, Locust invasion labelled 'Swarmageddon' by The Times of India as it reaches Delhi
2020 Jun 28," Global death toll from COVID-19 passes 500,000, doubling in less than two months (Johns Hopkins)"
2020 Jun 28," COVID-19 cases surge in southern and western US states with California, Texas and Florida closing bars, Arizona reports 20% of tests returning as positive"
2020 Jun 28, 50th anniversary of 1st Gay Pride march in New York City marked around the world
2020 Jun 29," US Supreme Court rules 5-4 that abortion restrictions in Louisiana unconstitutional, striking down a 2014 state law"
2020 Jun 29, Golden State Killer and former police officer Joseph DeAngelo Jr pleads guilty to 12 murders and dozens of rapes
2020 Jun 30, China's new national security legislation for Hong Kong comes into force
2020 Jun 30," For the 1st time less than half the working age population is working in Brazil, with 7.8 million losing their job March - May, according to Brazilian Institute of Geography and Statistics"
2020 Jun 30, FC Barcelona's Argentine soccer superstar Lionel Messi scores his 700th career goal - a cheeky Panenka penalty - in a 2-2 draw against Atlético Madrid
2020 Jul 1,"Europe opens its borders to 15 safe countries after months of lockdown, excluding the US, Brazil and Russia"
2020 Jul 1,Word record drug haul of 14 tonnes of amphetamines seized by Italian police in Salerno worth $1.1 billion. Thought made in Syria by Islamic State.
2020 Jul 1,"Australian state of Melbourne re-imposes a COVID-19 lockdown on 36 Melbourne suburbs affecting 300,000 people"
2020 Jul 1,"WHO says Middle East at ""critical threshold"" with COVID-19 cases over 1 million, 80% of deaths in Egypt, Iran, Iraq, Pakistan and Saudi Arabia"
2020 Jul 1,Russian President Vladimir Putin wins national referendum allowing longer presidential terms of office
2020 Jul 1,"America confirms more than 50,000 new COVID-19 cases in one day for the 1st time"
2020 Jul 2,Funeral for slain Ethiopian singer Hachalu Hundessa in Ambo amid nationwide unrest at his death that has killed over 80 people
2020 Jul 2,Texas Governor Greg Abbott makes wearing face masks mandatory as cases of coronavirus soar in the state
2020 Jul 2,More than 160 people die after a landslide at a jade mine in northern Hpakant area of Myanmar
2020 Jul 2,"British Darts Organisation’s commercial arm – BDO Enterprises Ltd, goes into liquidation due to lack of sponsorship; oversaw original professional, semi-pro and amateur competitions in Britain"
2020 Jul 4,"Record rain in over island of Kyushu in Japan causes flooding killing a least 37 people with evacuation of more than 200,00"
2020 Jul 5,"Mexico's COVID-19 death toll passes 30,000 as it becomes the world's 5th worst-affected country"
2020 Jul 5,"Florida reports a record 11,458 daily COVID-19 cases"
2020 Jul 6,"Zoonotic diseases, which jump from animals to humans, are increasing due to unsustainable farming and climate change according to new report by the UN"
2020 Jul 6,"Kansas City Chiefs quarterback Patrick Mahomes agrees to the largest contract for an athlete in sports history, inking a 12-year deal that could end up being worth US$503 million"
2020 Jul 6,America officially begins withdrawing from the World Health Organization
2020 Jul 7,Brazilian President Jair Bolsonaro announces he has tested positive for COVID-19
2020 Jul 7,"Texas records more than 10,000 daily cases of COVID-19 for the 1st time"
2020 Jul 7,"India surpasses Russia to become the world's third-worst affected country, daily COVID-19 cases exceeding 20,000 and total cases over 700,000"
2020 Jul 7,"Violent protests in Belgrade, Serbia, at government announcement of weekend lockdown due to COVID-19 surge"
2020 Jul 8,Australian city of Melbourne goes back into lockdown for six weeks after second outbreak of 700 active cases
2020 Jul 8,"Americans and Polynesians made contact around 1200 A.D. according to new genomic study in ""Nature"", people from eastern Polynesia had DNA from indigenous Colombia"
2020 Jul 8,US government issues directive that more than 1 million international students will be stripped of their visas if their courses entirely online
2020 Jul 9,"McGirt v. Oklahoma, in landmark case US Supreme Court rules Congress had not disestablished Oklahoma Indian reserves"
2020 Jul 10, Sixth century cathedral Hagia Sophia turned into a mosque by decree issued by Turkish President Recep Tayyip Erdogan (converted to a mosque 1453-1934)
2020 Jul 14," New study shows Andean condor, world's heaviest bird, can fly for 5 hours without flapping its wings (Proceedings of the National Academy of Sciences)"
2020 Jul 15," Heavy monsoon flooding in Indian north-eastern state of Assam affects more than 2 million people, kills more than 50"
2020 Jul 17," India becomes the third country to record 1 million cases of COVID-1, 56% concentrated in Maharashtra, Delhi and Tamil Nadu"
2020 Jul 18, Indian actor Amitabh Bachchan and his son Abhishek are hospitalized with COVID-19 in Mumbai
2020 Jul 19, World Formula 1 drivers champion Lewis Hamilton wins a record 8th Hungarian Grand Prix in Budapest to equal Michael Schumacher's record of wins at a single circuit (French GP)
2020 Jul 19," First Arab interplanetary mission, the Mars ""Hope"" orbiter launches on board Japanese H-2A rocket from Tanegashima Space Center"
2020 Jul 19," Iran’s President Hassan Rouhani says 25 million Iranians already infected with COVID-19, 35 million at risk (official figure just 269,440)"
2020 Jul 19," Portland Mayor Ted Wheeler criticizes federal policing of protesters in his city, calling it unconstitutional"
2020 Jul 20, Announcement that a COVID-19 vaccine developed by the University of Oxford (ChAdOx1 nCoV-19) is able to trigger immune response and antibodies
2020 Jul 20, United Kingdom suspends extradition treaty with Hong Kong in wake of new Chinese security laws for the territory
2020 Jul 20," Scientists find evidence of volcanoes on Venus, showing the planet is not as dormant as previously thought (Nature Geoscience)"
2020 Jul 20," Cristiano Ronaldo becomes first man to score 50 goals in Serie A, La Liga and the Premier League with a double in Juventus' 2-1 win over Lazio"
2020 Jul 21, Former Sudanese leader Omar Hassan al-Bashir goes on trial in Khartoum for the 1989 coup that toppled the government
2020 Jul 21, Russian interference in British politics is 'the new normal' according to report by British Intelligence and Security Committee
2020 Jul 21, European Union agrees huge €750 billion ($859 billion) post-COVID-19 stimulus bill
2020 Jul 21, Stage 1 of the controversial filling of Blue Nile River dam announced completed by Ethiopian PM Abiy Ahmed
2020 Jul 22," California passes New York total for COVID-19 cases (415,763 vs 415,094), though NY death toll much higher"
2020 Jul 22, Kim Kardashian asks for understanding of her husband Kanye West's struggles with his bipolar disorder on Instagram
2020 Jul 23," US confirmed cases of COVID-19 pass 4 million with death toll over 143,000. Real number of cases likely up to 13x higher according to CDC."
2020 Jul 23," China launches its first mission to Mars, Tianwen-1, a combined orbiter, lander and rover, from Wenchang Launch Site, Hainan Island"
2020 Jul 23," South Africa records more than 400,000 COVID-19 cases amid surging infections and decides to shut schools for a month"
2020 Jul 23," US President Trump says he could send 75,000 federal agents to deal with violence in American cities like Portland, drawing backlash"
2020 Jul 25, North Korea reports first 'suspected' case of COVID-19 in city of Kaesong
2020 Jul 25," Hurricane Hanna, 1st of the 2020 season, makes landfall on the Texas Gulf Coast as a category 1 storm"
2020 Jul 25, Cargo ship MV Wakashio runs aground off the coast of Mauritius and begins leaking oil
2020 Jul 26, Body of civil rights activist John Lewis crosses the Edmund Pettus Bridge in Selma for the last time (beaten there 55 years ago) with a military honor guard as part of a remembrance ceremony
2020 Jul 26, Italian football giants Juventus wins its 9th straight Serie A title with goals from Cristiano Ronaldo and Federico Bernardeschiin in a 2-0 win over Sampdoria
2020 Jul 27, US congressman John Lewis becomes the first black lawmaker to lie in state in the Rotunda in Washington D.C.
2020 Jul 27," Google decides its employees can work from home until July 2021, the largest tech company to commit to working from home"
2020 Jul 27," WHO head Tedros Adhanom Ghebreyesus states that COVID-19 is ""easily the most severe"" global health emergency the WHO has faced"
2020 Jul 28," Former Malaysian Prime Minister Najib Razak found guilty of corruption, sentenced to 12 years and fined nearly $50 million"
2020 Jul 28," Iter, the world's largest nuclear fusion project, begins assembly in Saint-Paul-lez-Durance, France"
2020 Jul 29, Scaled back Hajj pilgrimage begins in Saudi Arabia with no foreigners
2020 Jul 30," NASA launches to Mars its Perseverance rover and Ingenuity helicopter aboard a V 541 rocket from Cape Canaveral, Florida"
2020 Jul 30," Barack Obama gives the eulogy at the funeral of congressman John Lewis, with former presidents George W. Bush and Bill Clinton at Ebenezer Baptist Church in Atlanta"
2020 Jul 30, The US economy posts the largest quarterly fall on record with GDP down 9.5% for the 3 months to June 30
2020 Jul 30, Federal law enforcement officers begin a phased withdrawal from Portland amid criticism of their actions to shut down Black Lives Matter protests
2020 Jul 31," Eurozone economic activity falls 11.9% for April-June with Spain the worst at -18.5%, its deepest in modern times"
2020 Jul 31," Mexico overtakes the UK to have the world's third highest death toll from COVID-19 with 46,688 fatalities"
2020 Jul 31," Apple wildfire starts near Beaumont, California, forcing the evacuation of nearly 8,000 people over the next few days"
2020 Aug 1,"Egypt tells Elon Musk its pyramids were not built by aliens, after Musk tweets in support of a conspiracy theory that they did"
2020 Aug 2,"SpaceX Dragon capsule carrying NASA astronauts Doug Hurley and Bob Behnken splashes down in the Gulf of Mexico, 1st commercial crewed mission"
2020 Aug 2,Australian state of Victoria announces state of disaster and imposes further lockdown measures after spike in COVID-19 cases
2020 Aug 2,"South Africa confirms over 500,000 cases of COVID-19 with 10,107 deaths, highest total on the African continent"
2020 Aug 2,United Arab Emirates starts up the Arab world's first nuclear power station at the Barakah plant
2020 Aug 2,"Islamic State stages a jail break at a prison in Afghan city of Jalalabad, placing bombs at its entrance, results in 20 hr gunfight, 29 deaths and over 300 prisoners at large"
2020 Aug 3,Spain's former King Juan Carlos announces he will go into exile abroad amid his implication in a corruption inquiry
2020 Aug 3,"Number of Iranian COVID-19 deaths triple that of government tally, showing 42,000 have died instead of 14,405, according to BBC Persian Service investigation [1]"
2020 Aug 3,"Hurricane Isaias makes landfall in the US as a Category 1 hurricane near Ocean Isle Beach, North Carolina"
2020 Aug 4,"UN says COVID-19 pandemic has created biggest educational disruption in history affecting nearly 1.6 million students in 190 countries, 94% worldwide [1]"
2020 Aug 4,"COVID-19 infection spike forces a return to lockdown in Manila and surrounding provinces in the Philippines, affecting 27 million people as cases pass 100,000"
2020 Aug 4,"Huge explosions at the port of Beirut, Lebanon, kill more than 200 and leaves over 6,000 thousand people injured"
2020 Aug 5,Indian Prime Minister Narendra Modi lays the cornerstone for a new Hindu temple at Ayodhya Ram to replace a previous Muslim mosque
2020 Aug 6,"COVID-19 detected cases in Africa pass 1 million with 21,983 deaths"
2020 Aug 6,"US COVID-19 death toll could reach 300,000 by 1 December, about 70,000 lives saved if masks worn consistently, according to University of Washington study [1]"
2020 Aug 7,"Cardi B releases single ""WAP"", featuring Megan Thee Stallion, debuts at No. 1 on Billboard Hot 100"
2020 Aug 8,Music mogul Simon Cowell breaks his back riding an electric bike
2020 Aug 9,"PGA Championship Men's Golf, TPC Harding Park: 23 year old American Collin Morikawa fires final round 64 (-6) to win his first major title by 2 strokes from Paul Casey of England"
2020 Aug 9,New Zealand marks 100 days without community transmission of COVID-19
2020 Aug 9,"Brazil passes 100,000 COVID-19 deaths, the world's 2nd highest, with over 3 million recorded cases"
2020 Aug 9,Disputed Belarusian presidential election sees long time dictator Alexander Lukashenko officially win 80% of the votes but unofficially lose 60-70% of the votes to main opposition candidate Sviatlana Tsikhanouskaya. Sparks widespread protests in Belarus and international condemnation.
2020 Aug 10," Global COVID-19 cases pass 20 million and is accelerating, 1st 10 million took almost 6 months, 2nd 10 million took just 43 days (Reuters)"
2020 Aug 10," Lebanese Prime Minister Hassan Diab announces his government is resigning, less than a week after massive industrial explosions devastated Beirut"
2020 Aug 10," Rare wind storm (derecho) hits the US Midwest flattening cornfields, leaving hundreds of thousands without electricity, killing two people"
2020 Aug 10, Hong Kong tycoon Jimmy Lai is the most high-profile figure arrested in Hong Kong under its new security laws
2020 Aug 11," US Democratic candidate for President Joe Biden announces California Senator Kemala Harris is his running mate, the 1st woman of color selected by a major party"
2020 Aug 11," President Vladimir Putin in a propaganda stunt announces Russia has become the 1st country to grant regulatory approval to a Covid-19 vaccine, called “Sputnik V"", despite no scientific data being published or phase 3 trials having even begun"
2020 Aug 11, Belarus's opposition leader Sviatlana Tsikhanouskaya flees the country amid large-scale protests over the country's disputed election results that returned Dictator Alexander Lukashenko to power
2020 Aug 12," UK posts its worst quarterly economic slump on record, -20.4% (Apr-Jun), pushing it into the largest recession worldwide"
2020 Aug 12," Europe fights a new COVID-19 surge with Germany, France and Spain posting their largest daily infection totals for three months"
2020 Aug 12," Yemen authorities say at least 172 people died in floods caused by torrential rains, which have also destroyed historic buildings in Sanaa, a Unesco World Heritage Site"
2020 Aug 13," Israel strikes historic deal with the United Arab Emirates to normalize relations, Israel suspends plans to annex parts of the occupied West Bank"
2020 Aug 13," New details about enormous ""Terror Crocodile"" (Deinosuchus), the size of a bus, with teeth as big as bananas, that lived during late Cretaceous period (75-84 million years ago) in North America published [1]"
2020 Aug 14," Joshua Cheptegei of Uganda breaks Ethiopian legend Kenenisa Bekele’s 16-year-old 5,000m world record with a run of 12:35.36 at the Diamond League meet in Monaco"
2020 Aug 16," Largest-ever demonstration in Belarus as 100,000 people gather in Minsk to protest against controversial election results and regime of Alexander Lukashenko"
2020 Aug 16," At least 17 people killed in attack on beach resort in Mogadishu, Somalia, by al-Shabab group"
2020 Aug 16," World Snooker Championship, Crucible Theatre, Sheffield: Englishman Ronnie O'Sullivan wins his 6th world title with an 18-8 win over countryman Kyren Wilson"
2020 Aug 16," Japan's economy, the world's third largest, posts its worst-ever decline, falling 7.8% (April-June quarter)"
2020 Aug 16," Biggest protests in Thailand in six years as 10,000 people demonstrate in Bangkok for reforms of the government and the monarchy"
2020 Aug 17, University of North Carolina at Chapel Hill is the 1st US college to send students home and convert to online classes after 135 COVID-19 cases detected
2020 Aug 18, Joe Biden is formally nominated as the Democratic party's presidential candidate during the second night of their 1st ever virtual convention
2020 Aug 18, California Governor Gavin Newsom declares state of emergency as 27 fires burn across the state amid a continuing heat wave
2020 Aug 18, Mali's President Ibrahim Boubacar Keïta resigns amid a military coup condemned by the UN Security Council
2020 Aug 19," Apple becomes the 1st US company to be valued at $2 trillion, just 2 years after it reached $1 trillion valuation"
2020 Aug 19," Largest floods in 70 years wet the toes of giant 71m Leshan Buddha carved by a river just outside Chengdu, China with 100,000 people evacuated"
2020 Aug 19, US Postmaster General Louis DeJoy says he will suspend controversial plan to cut costs until after the election
2020 Aug 19," Golfing dinner termed #GolfGatet appearing to flout COVID-19 restrictions, attended by Irish political figures, prompts two politicians to later resign"
2020 Aug 20," Former adviser to Donald Trump, Steve Bannon arrested and charged with fraud over a fundraising campaign to build a wall on the Mexican border"
2020 Aug 20, Russian opposition figure Alexei Navalny falls into a coma after a suspected poisoning (later confirmed to be Novichok poisoning)
